,overall,verified,reviewTime,reviewerID,asin,style,reviewerName,reviewText,summary,unixReviewTime,vote,image
796,5,True,"09 24, 2013",A3CZ890UHC8HHZ,B0009RF9DW,{'Size:': ' 6.6 oz'},Amazon Customer,"It diffuses a very mild light perfume, just what I wanted. I wear Shalimar lotion and perfume so I wanted a nice hint on days I do not want to wear the stronger lotions and perfumes. I will be purchasing it again.",What I expected,1379980800,,
2893,5,False,"07 12, 2014",A125TMC44CJBKK,B0012Y0ZG2,{'Size:': ' B-020'},Mustang Shelly,All time favorite!!!! Wish they still carried this!!!,Five Stars,1405123200,,
2817,5,True,"12 28, 2014",A3JDSBP01M7R2R,B0012Y0ZG2,{'Size:': ' 112'},Tim A. Brooks,One of my wife's favorites.,Five Stars,1419724800,,
1145,5,True,"03 3, 2014",A2HT5WENL8E5S6,B000FI4S1E,,Shasta Masser,If you have body acne this product is a must. I noticed a difference on my back and chest within the first week of using this body wash. It helps heal what is already there and helps prevent 95% of it from reoccurring!,Acne Body Wash A MUST,1393804800,,
3830,5,False,"11 7, 2014",A7LAYX9R7IMOO,B0012Y0ZG2,{'Size:': ' 123'},andre luiz,I really is what I expected,Five Stars,1415318400,,
2278,5,True,"04 7, 2018",A29PKN4LL05QGF,B0012Y0ZG2,{'Size:': ' 8.5oz'},Danielle,Lathers well and smells great.,Five Stars,1523059200,,
860,5,False,"11 11, 2012",ACA81N25RHH2N,B0009RF9DW,{'Size:': ' 8'},L Lovera,"Don't just take my word for it, you must try it. A dear friend got me this from Italy 12 years ago and have been using it since, very hard to find it in the US. This shower cream will transform your shower experience, beautiful fragrance living your skin smooth and you will feel completely relax as if you just spent the day at the SPA, I LOVE it it's one luxurious treat for myself! Give it a try, you won't be disappointed but buy it as soon as you find it, like I said, very hard to find it in the US.",Spa in a bottle,1352592000,,
4171,5,False,"09 16, 2017",A3NM1MT3Q2FHXV,B001LNODUS,{'Color:': ' Lavender Blossoms'},S.E. Poza,"Note: At the time of this review, seven different products are being sold on the same page. I am reviewing the lavendar lavender blossoms.

This is a generous amount of dried (loose) lavender blossoms designed to act in the same fashion as potpourri. The most important aspect to this product is the scent which I found to be delicate and natural. Lavender in general can be fairly overbearing, and you can smell this through the packet as it is relatively potent. However, it is not cloying or suffocating in its potency. I'm guessing this is because it's not as concentrated as a perfume or extract.

When you have the bag open and are exposed to all of it at once, it seems really strong, but as something you place in a location in lesser quantities, it doesn't tend to be so overbearing. I think that it strikes a good balance between being potent enough to have an effect and not being so potent as to make you queasy from a strong scent. I have had a lavender-scented face mask (the sort filled with beans that you heat or cool and apply to your face) for some time and found that putting that mask in a plastic zipper bag with a sachet made from these dried blossoms helped revived the fading scent quite well without have to risk staining the mask or making it smell too strong from using oils or perfume.

If there is any weak point to this, it is the presentation which can be a bit messy. I had to be very careful when opening the package not to spill the small, dried bits. It would have been better if it had come in a resealable package or a jar of some sort given how tiny they are. I decanted mine into a jar both to keep the scent contained in the long run and to more easily manage them. Still, since this point is intrinsic to the type of product this is (tiny dried blossoms), I'm not dinging it for that, but just noting it.",good natural scent,1505520000,,
608,5,True,"01 31, 2016",AD42QCRPG1RKG,B0009RF9DW,{'Size:': ' 136'},Pen Name,"It was good, my loved her gift!",Five Stars,1454198400,,
888,3,True,"03 25, 2018",A3T2BPXBDMLJPE,B000FI4S1E,,GabesAmazon,Good light scent. Have received complements from people that I smell nice after using it. 3 stars because bottle is kind of small for a shower gel (size compariso photo attached) and it doesnt really help me wake up in the morning like other products.,Good light scent,1521936000,,"['https://images-na.ssl-images-amazon.com/images/I/61iM-DR-wgL._SY88.jpg', 'https://images-na.ssl-images-amazon.com/images/I/710+28paxwL._SY88.jpg']"
1549,5,True,"08 9, 2016",A3HA7DWA3A6P4D,B000URXP6E,{'Size:': ' 41'},Stellina Reed,Great Product; does wonders for colored treated hair.,Five Stars,1470700800,,
3672,5,True,"08 27, 2015",AJIQ6LH2YTZH8,B0012Y0ZG2,{'Size:': ' 354'},Dolores A. Ruscavage,I use Oglivie hair perm all of the time.  It's a great product for fine hair.,It's a great product for fine hair,1440633600,,
513,5,True,"09 28, 2017",A35QTJ23YREVYX,B0009RF9DW,{'Size:': ' 27'},G.I.M.,"I read that sponges need to be changed once a month... This product combines a body wash and sponge in one! The skin feels so clean each time I used it! And the sponge gives a gentle scrubbing sensation. To prolong its life, I first wash my hair (my body gets wet) turn off the water and scrub/soap-up my whole body with the Spongelle. Once done, I simply rinse off with the shower. This helps reduce water waste and prolong Spongelle's useful life-span. About a month and a half after first use, I start adding some of my favorite body wash. And after three months I replace it with a new one.","Cleanest feel, soaps up well and lasts over a month!",1506556800,,
2435,5,True,"11 3, 2016",ASL42Q7LYJWFV,B0012Y0ZG2,{'Size:': ' 74'},Janet Roseblatt,Tried many but this is the one to buy.,A favorite shower bathing gel.,1478131200,,
4469,5,True,"01 4, 2016",A1X60YTH1F0Y9A,B001OHV1H4,{'Size:': ' 11 fl. oz.'},G &amp; L,"Finding a ""natural"" shampoo that isn't disappointing is a challenge. They usually fail to lather and leave hair feeling dry or dull. This shampoo lathers just enough and as someone with straight, somewhat thin hair, I've been pleased with the way this shampoo really does smooth the hair but without weighing it down.",They usually fail to lather and leave hair feeling dry or dull. This shampoo lathers just enough and as someone ...,1451865600,,
1550,5,True,"08 8, 2016",A1CJRTU646COUL,B000URXP6E,{'Size:': ' 156'},Lucina Ramirez,"I used its works, I is good",Five Stars,1470614400,,
3455,5,True,"08 24, 2016",A14QBW6X0Q1YSD,B0012Y0ZG2,{'Size:': ' 58'},Susan J. Bedore,"Love  the scent and it work better than any other mousse I have used. it makes my hair look natural, not stiff. My hair is shinier and fuller. Great stuff.",Love the scent and it work better than any other ...,1471996800,,
3677,5,True,"08 23, 2015",A358YXSQDOI4N5,B0012Y0ZG2,{'Size:': ' B-020'},bc1941,Great product,Great,1440288000,,
1644,5,True,"03 20, 2016",A17ZAS11CK1HG8,B000URXP6E,{'Size:': ' 177ml/6oz'},Joni28,I love the smell of this product. I also bought the body butter and that smells great as well. I will be buying these again,Great product!,1458432000,,
849,5,True,"03 1, 2013",A2EBR70V6P9W0N,B0009RF9DW,{'Size:': ' 124'},karhill54,"This gel uses what feels like small seeds as the scrubbing particles. but there are too few of them to be of any real help as a body scrub. As a cranberry-scented, foaming body wash, it's out of this world heavenly! Just so luscious it makes me hungry just smelling it. It's also thick and makes a LOT of lather with only a minor amount of the gel on a bath sponge. At this price, if you like cranberry-scented B&B products, this will more than meet your standards.",As a scrub - 2 stars; as a scented body wash - TEN ********** !!!!,1362096000,2,
3998,5,True,"08 21, 2013",A11AZPF8R6A1F8,B0012Y0ZG2,{'Size:': ' 32'},Trini Chic,"Great product that works well when used together with repair formula conditioner. Love the way my hair felt after shampooing,",It really works,1377043200,,
2977,5,True,"11 12, 2013",A7VOU5ARHQ20F,B0012Y0ZG2,{'Size:': ' 19'},Medraut,Love this stuff.  It works better on my Psoriasis better then the medical creams and ointments the doctors prescribed.  Too bad they stopped making it.  Horde it all now because someday it will be gone and you will be forced to use head and shoulders.,noting clears up Psoriasis better.  too bad it's discontinued,1384214400,2,
1296,3,False,"04 6, 2013",A2OCDK0BOW6UCY,B000NKJIXM,,Antigone Walsh,"I thought this rinse might be a more palatable alternative to Listerine Total Care.  But with average performance and a questionable active ingredient, it is unlikely that I will use this again.

The rinse comes in an easy to used bottle with a pleasing contour. I did not particuarly care for the wintergreen flavor, it was rather sweet, mint-like and artificial. But my major concern come from the potential side effects for the active ingredient, cetylpridinium chloride. While it has antiseptic, anesthetic and disinfectant properties it is used in bug poisons as well as dental preparations. While its use has been FDA approved, I think there are more natural, less toxic and equally effective ingredients available. Moreover this ingredient has been known to cause browning of the teeth as well as intefering with the sense of taste. The bottle label warns of the discoloration risk but claims that the staining is neither permanent nor harmful. It claims such stains may be removed by brushing or ""at your next dental visit"". If my teeth suddenly browned, I don't think I would want to wait for my next regularly scheduled dental visit. Dental visits don't rate high on my fun things to do list and I would rather not spend my discretionary income on removing tooth discoloration caused by a mouth wash.

So while the performance of this rinse was adequate, I will pass until they change the formulation.",Concerned About Active Ingredient,1365206400,,
1283,4,False,"08 19, 2008",A3R9H6OKZHHRJD,B000LIBUBY,"{'Size:': ' 3.4 fl oz', 'Scent Name:': ' Pomegranate Anise'}",LH422,"This is an absolutely beautiful fragrance.  The pomegranate-anise combination is just brilliant.  It's sweet and fruity and just a little bit spicy.  Think red fruits with a hint of spice.

I would give this a 5 except that it doesn't last very long.  Longer staying power and it would be perfect.",Brilliant Scent,1219104000,3,
689,5,True,"01 27, 2015",A1N4MVSWIRSMIT,B0009RF9DW,{'Size:': ' 295'},MELINDA A HUNNICUTT,Hope they come back with this scent,Five Stars,1422316800,,
3820,5,True,"12 2, 2014",A1RO0GOES15LER,B0012Y0ZG2,{'Size:': ' 82'},Michelle,Loved this. ... but I can't fInd more. ... anywhere!,Five Stars,1417478400,,
738,5,True,"07 5, 2014",A3GAYXUN80BG07,B0009RF9DW,{'Size:': ' 277'},Rosie,My aunt loves it!  I will get her some more when she runs out.,My aunt loves it! I will get her some ...,1404518400,,
2199,5,False,"09 7, 2017",A3VJ27010XUWTF,B0010ZBORW,{'Color:': ' Foot File'},C. Wong,This foot file is great. I used it only for my feet. I have diabetes so taking good care of my feet is high priority for me.  I do have a battery operated one already but this one is so convenient for travel and when the batteries start to run out. I tried it on both of my feet and it was gentle and effective  for work on my calluses.,Gentle and Effective Foot File,1504742400,,
4751,3,False,"04 14, 2013",A2068BC3ZXAVJQ,B00DY59MB6,{'Size:': ' 33.8 Ounce'},scesq,"I have problems with my teeth so my dentist really wants me to use some sort of dental rinse. I have tried a few of the Crest Pro Health products. This version is alcohol free and is geared toward people 50 and older but has the same active ingredient as the Pro Health Invigorating Clean Invigorating Mint  alcohol based mouth rinse. It does not have fluoride.

I wish Crest would better explain how this is different from the products geared toward people under fifty.  For instance people of any age can have plaque, bad breath and inflamed gums. I think most of the Crest mouth rinses work against these issues so what makes this special for people over 50.

I did find this sentence on the back label of the bottle. ""This rinse was selected for people over 50 because it is alcohol-free and provides a unique sensation.""  I am not sure what ""a unique sensation"" has to do with being over fifty.  If that is the only reason it seems like other Crest Pro Health alcohol free products would work the same.

I like the taste of this product. It does not have the bitter alcohol flavor that  many alcohol flavored mouth rinses have. I don't notice a unique sensation.

I am troubled that the only reason Crest lists for this being for people over 50 is it has no alcohol and has a unique sensation. For this reason I gave this three stars.",I Am Not Happy With the Explanation As to Why This is for People Over 50,1365897600,,
2097,5,True,"08 6, 2013",AZ4T3DDT8L9EQ,B000URXP6E,{'Size:': ' 30mla144'},Michelle Adams,THIS IS WHAT BODY GLOSS IS SUPPOSED TO BE LIKE... IT JUST SHOULDNT HAVE TO COST SO MUCH TO BUY,PERFECTION,1375747200,,
2437,5,True,"11 2, 2016",AMFBQ5BEYWC5T,B0012Y0ZG2,{'Size:': ' 8'},Amazon Customer,"This is a delicious luxury that I have been enjoying for many years. There is no other aroma like it. Makes me feel like a pasha, and want to break out my safari hat. Thanks to Amazon I no longer have trouble finding it. A dime sized dollop goes a long way, so even the smaller container lasts quite a long time.",My favorite shower gel.,1478044800,,
675,5,True,"03 22, 2015",A1QQHWTPZYIXM3,B0009RF9DW,{'Size:': ' 203'},D. Oldham,Sweet smelling bubbles and nourishing skin care!,Victoria Secrets Pink body wash!,1426982400,,
34,1,True,"03 27, 2018",A2V608ILSK1M5R,B00006L9LC,{'Size:': ' Small'},CDART815,My product was not sealed and either used or something.. attached are pictures. Would like a refund please.,Beware,1522108800,2,"['https://images-na.ssl-images-amazon.com/images/I/71qwEe9fFRL._SY88.jpg', 'https://images-na.ssl-images-amazon.com/images/I/613pdv8QlbL._SY88.jpg']"
144,5,True,"10 20, 2016",A3KXVT8LE6X9LR,B00006L9LC,{'Size:': ' 561'},415sf,ive been using this cleanser for a few years now. i only found it in korea and brought a few tubes every time i visit (once a year). gentle but gets all the crap off. so happy to see it available stateside now.,gentle but gets all the crap off. so happy to see it available stateside ...,1476921600,2,
322,5,True,"07 27, 2015",AXF86QVFWFE4L,B00006L9LC,{'Size:': ' 10.1 oz.'},Janet Hobbs,Good product,Five Stars,1437955200,2,
3557,5,True,"03 18, 2016",A1BS75OBCJN3EA,B0012Y0ZG2,{'Size:': ' 1'},TG,"love this product - wish I could find it in the store, but it's great to be able to get here",love this product - wish I could find it in ...,1458259200,,
2197,5,False,"09 8, 2017",AIEEK7AHXKZCC,B0010ZBORW,{'Color:': ' Eye Pillow'},BeatleBangs1964,The eye mask does a good job of blocking out light and the delightful aroma of lavender makes for a very peaceful experience.  Using this is like a mental trip to a spa.  The lavender is a nice added touch that is as gentle to the nose as the mask is to the eyes.  It is also easy to clean and keep clean.  I had one of these several years ago.,Eye Spa,1504828800,,
677,5,True,"03 18, 2015",A1577W1CXJ2WI9,B0009RF9DW,{'Size:': ' 500ml'},Lori E. Hoover,Luv it!,Five Stars,1426636800,,
656,5,True,"06 14, 2015",A20K51AP7RX6V8,B0009RF9DW,{'Size:': ' 8'},David,Hard to find and expensive but I love this shower cream.  I first discovered it more than 10 years ago and I'm very happy to be reacquainted with it.  The best part about it is that it says with you all day.,Hard to find and expensive but I love this shower cream,1434240000,,
2725,5,True,"06 29, 2015",A1F1B2NU2TQAJV,B0012Y0ZG2,{'Size:': ' 70'},Jennifer Tschida,Would love theorizing as well. Not available at this time.,Excellent.,1435536000,,
273,5,True,"12 23, 2015",A2S696CI415O20,B00006L9LC,{'Size:': ' 11 fl. oz.'},Q.C. Stickler,I'm a fan!,I'm a fan!,1450828800,,
2121,5,True,"05 27, 2013",A32MXI9376X72P,B000URXP6E,{'Size:': ' 33.8 oz'},furga,"Not found often elsewhere, such as Sephora and other similar stores.
It's not cheap but it lasts for a long long time.",Huge! Really,1369612800,,
2047,5,True,"12 8, 2013",A2AHJ14T0JXO1M,B000URXP6E,{'Size:': ' 188'},Rachael Heade,My husband loves the bergamot fragrance and most of the local brands are mixed with other more feminine scents. This is just the bergamot and is great refreshing body wash.,Great for my Guy :-),1386460800,,
4071,5,True,"02 8, 2013",A1D18EJF6LHYDV,B0012Y0ZG2,{'Size:': ' 80'},Penny Allen,"I was nervousness about the scent because IVe never tried this, but I love Paul Mitchell so I decided to try it.  It smells great!!!  This is a medium hold spray, so I'll use it when my hair is down (I use a stronger hold when I put my hair up).  Shipping speed was good to Alaska too.",Smells great,1360281600,,
1637,5,True,"03 27, 2016",ASI6Y3IN52G9P,B000URXP6E,{'Size:': ' 351'},SeattleFamily,This is a fantastic loose eye shadow set! The pigmentation is phenomenal and the color choices are great! I love this set!,This is a fantastic loose eye shadow set!,1459036800,,
4395,5,True,"06 10, 2016",A2I3TOK508FLX0,B001OHV1H4,{'Size:': ' 1'},Amazon Customer,"Great product , price and fast shipping","Great product, price and fast shipping",1465516800,,
3254,5,True,"04 13, 2018",A2H1NTYWYYA0XM,B0012Y0ZG2,{'Size:': ' Multiset'},Antonio Gosain,"Divine smell, cleaning properties and after-use smell! 5/5 stars.",Five Stars,1523577600,,
2189,5,False,"09 11, 2017",A33PVCHCQ2BTN0,B0010ZBORW,{'Color:': ' Nail Brush'},VW,"I really like this nail brush from Urban Spa. The curved shape of the wood as well as the bristles makes it easy to grip when scrubbing under my nails. The wood is smooth and has a light finish on it. The thin row of bristles is cut short and it's stiff, so it really gets under the nails to remove garden dirt or anything else. The other side of the brush has a wider row of slightly softer bristles that clean the skin well. The brush dries quickly after use. Shedding is minimal. Overall, this is a handy little nail brush. I find it much easier to use than the plastic ones that are one-sided.","Handy nail brush, gets garden dirt out from under nails",1505088000,,
2981,5,True,"10 30, 2013",AT55FHUTTF5DM,B0012Y0ZG2,{'Size:': ' 328'},Loonytoon.,I always get compliments when I wear this perfume. It was delivered in a timely manner. It looked just like the picture. The price was nice.,I LOVE IT!!!,1383091200,,
1329,5,True,"04 28, 2018",ADW00ZRLWD3KG,B000URXP6E,{'Size:': ' Small'},Walaa,I received the shampoo because I was suffering from dandruff and I was like ok lets try it and I couldn't believe the result from only just one wash. it cleared out the dandruff without drying my hair out. My hair felt smooth and Fresh after just the first wash. I tried aveda spray before but it was useless and waste of money,... because I was suffering from dandruff and I was like ok lets try it and I couldn't believe the ...,1524873600,,
2505,5,True,"07 2, 2016",A1L887BYCTVXH6,B0012Y0ZG2,{'Size:': ' 463'},Aidan D.,Miami is my favorite,Five Stars,1467417600,,
3235,5,False,"05 5, 2018",AKFUG2XFPPWWM,B0012Y0ZG2,{'Size:': ' Small'},Donovan,10 stars right here. This product helped me with my itchy skin and my sister's greasy hair complain.,Five Stars,1525478400,,
4779,4,False,"08 12, 2014",A2WW57XX2UVLM6,B00EYZY6LQ,,Talvi,"First off - I love the scent. A hint of flower and mint makes a great combination that doesn't overpower and is gone by the time I leave the door in the morning.

I do have very fine hair and this works great. I wouldn't recommend it for thick hair - you'd have to use far too much of it. But for thin hair that gets limp fast if the product has too much wax/silicates, this gives volume without weighing down hair.  I didn't have to use a lot of styling products afterwards that always seem to make my thin hair stiffen and flatten.

A small ball rapidly expands as you put it in your hair, so a little goes a lot way.  I use this on days when I need a bit of extra conditioning - for meetings and such.  It is more expensive than store bought conditions but on par with salon varieties.  And I do trust the Fekkai name.",Works Well For My Thin Hair,1407801600,,
3133,4,True,"08 12, 2014",A1VTPPQNT23IU8,B0013NB7DW,{'Size:': ' 7 Ounce'},Birgitta L Ramsey,Really does the job. One of the best. Quality of the product is excellent.,Preshave lotion,1407801600,,
2596,5,True,"02 21, 2016",A8B6JCPLPWVK5,B0012Y0ZG2,{'Size:': ' 70'},DLS,"Love this product! The scent is subtle, fresh and it leaves your skin feeling soft.",Great fresh scent!,1456012800,,
1900,5,True,"12 15, 2014",A2H99IQJ0JT4MU,B000URXP6E,{'Size:': ' 143'},karen stanley,Love it,Five Stars,1418601600,,
2178,4,False,"10 7, 2017",A1AEPMPA12GUJ7,B0010ZBORW,{'Color:': ' Sea Sponge'},Glenda Boozer,"I don't think I've ever had a real sponge like this before, and it's great for having my back scrubbed. It does not irritate my skin, and it feels good. There's one side effect I hadn't thought of - the cat attacked it like it was alive and he was determined to kill it. I had to take it away from him and put it where he couldn't easily get to it. My own little pet skeleton, right?",I don't think I've ever had a real sponge like this before,1507334400,,
2859,5,False,"09 20, 2014",A37DCOJBXHTODF,B0012Y0ZG2,{'Size:': ' 214'},LUVSTAWKIN,Love it!,Five Stars,1411171200,,
2480,5,True,"07 26, 2016",A3RQS9GT66TEB8,B0012Y0ZG2,{'Size:': ' 43'},W. Schilling,I like the way it cools my head and cleans my hair,Cooling,1469491200,,
1887,5,True,"01 12, 2015",A2SUH2N8051BES,B000URXP6E,{'Size:': ' 12-Ounce (Pack of 3)'},M. Striffolino,Wonderful fragrance. Love It.,Five Stars,1421020800,,
223,5,True,"03 25, 2016",A2JPJPB0A1TQTY,B00006L9LC,{'Size:': ' 392'},DeWaun Mack,Excellent! Best soap I ever had.,Best soap,1458864000,,
923,5,True,"01 1, 2017",A250XH0NBH6AHN,B000FI4S1E,,deborah c. mcclellan,This product is very gentle on my skin,Five Stars,1483228800,,
2152,5,True,"02 23, 2013",A24FALIPWP6850,B000URXP6E,{'Size:': ' 340'},Daniel Smith,"I wanted to get my 75 year young mother something she would enjoy & not be upset about the cost-(she worried about me for 35+ years) when the package arrived & she saw that mixed w/ my normal items (tools,blades,knives-ect)was a package of some lavender smelling something, she said, as most mom's say-""I hope you didn't spend much on anything for me""-after she used the soap & walked into the living room, she said ""what a wonderful soap & such a thoughtful gift"" I know my mom loves lavender (I smell like wood most of the time) she still remarks on how well she enjoys the soap & it does have a long lasting fragrance- if any of you men out there, have a mother,daughter,sister or wife, that likes lavender & relaxes when they do what ever women do in the bathroom- you will make some points by investing a few $ in this soap- such a simple thought w/ wonderful results- Thanks once again Amazon & thanks EO for a wonderful product",EO Lavender & Aloe everyday soap,1361577600,2,
4917,5,False,"08 28, 2017",AKMEY1BSHSDG7,B00W259T7G,"{'Size:': ' 250 Gram', 'Color:': ' Tiare'}",J. Arena,"I will most definitely be back for more! This soap is the most unusual bar soap I have ever used. Just the weight of the bar tells you it is different from anything you've ever picked up in the drug store. The lather is rich, the scent lingers but in a very soft way, and it simply left me feeling so fresh. Slowly but surely, I'll be trying every scent in this line. I'd love to use them as sachet to give that same subtle freshness to my clothing!",Such a feeling of luxury!! :),1503878400,,
1365,1,True,"03 27, 2018",A3IOV1NJ4IM2HC,B000URXP6E,{'Size:': ' Small'},E,"Throwing it away, burned my scalp.",One Star,1522108800,,
5244,5,True,"02 2, 2017",A3A8F2URN7MEPR,B00VARTPKS,,Sheila T.,My favorite powder!,Five Stars,1485993600,,
4293,4,True,"03 9, 2017",AIQ0ABOHK58F6,B001OHV1H4,{'Size:': ' 28'},Caridad J.,Very happy with my first time using it my hair was manageable,Four Stars,1489017600,,
1533,4,True,"09 21, 2016",A2WNVJ6S7OVZP4,B000URXP6E,{'Size:': ' 15'},Amazon Customer,It worked very well i disliked nothing,Four Stars,1474416000,,
1761,5,True,"08 27, 2015",A1MBLC4ZSP4QEB,B000URXP6E,{'Size:': ' 52'},Richard A.,great product,Five Stars,1440633600,,
4987,4,False,"03 28, 2013",A2OCDK0BOW6UCY,B016V8YWBC,{'Size:': ' 4 Ounce (8 Count)'},Antigone Walsh,"This is a great little soap. It is gentle enough to use on the face as it contains both moisturizing cream and mild exfoliants. As it is marketed to men,it has a strong woodsy/green aroma. I personally prefer the freshness one finds in most men's fragrances. I liked this one but  less is more. Although the scent dissipates somewhat, it is still quite noticeable. Therefore, I think it is better used as a body bar than a facial cleanser.

My experience with Dove products has been positive. They are good quality and reasonably priced. I think most men would be receptive to skin care but I think that subtle fragrance is more appealing than aggressive perfumes.",Strongly Scented Soap,1364428800,,
3226,5,False,"05 12, 2018",AUS96J3A7A9MK,B0012Y0ZG2,{'Size:': ' Small'},Kirk Wiper,"Got both products from this seller, shampoo and body wash. Both - top notch. 5 stars",Selenium is awesome!,1526083200,,
5170,5,True,"11 7, 2016",A121C9UWQFW5W6,B00CQ0LN80,,Barbara Wallace,Just what I wanted and it arrived early,Five Stars,1478476800,,
