,overall,verified,reviewTime,reviewerID,asin,style,reviewerName,reviewText,summary,unixReviewTime,vote,image
4845,4,False,"09 29, 2017",AT53ZTTO707MB,B00W259T7G,"{'Size:': ' 250 Gram', 'Color:': ' Patchouli'}",I Do The Speed Limit,"I have another brand of bar soap with a much more potent patchouli fragrance.  I had hoped that I would be able to bury my nose in this bar from Pre de Provence and imagine that I had just opened a bottle of patchouli essential oil.  No, no, it did not happen.  While it is a lovely fragrance, it is somewhat meek and mild.  Maybe that is what you are looking for, but I wanted deep, true, powerful patchouli.

With this bar from Pre de Provence I do get rich, smoothing and soothing moisturizing.  It was opportune that I had recently purchased two bars of soap from Plantlife, patchouli and sandalwood.  Oh, my!  Those fragrances are potent and wonderful!  Way more so than those from Pre de Provence.  Having the two patchouli bars at the same time allowed me to see the moisturizing qualities of both soaps.  The Plantlife dried my skin.  This Pre de Provence always left my skin soft and supple.  It was a BIG difference; so easy to see when I had the two together.

So, when it comes to the patchouli and the sandalwood soaps, which one you would like better depends on what you are looking for in a soap:  True potent fragrance or moisturizing luxury.  For me it boils down to my skin's needs in the cooler, drier months, and that means I go with the Pre de Provence.

If you do want to try the Plantlife patchouli, this is it:&nbsp;<a data-hook=""product-link-linked"" class=""a-link-normal"" href=""/Patchouli-100-Pure-amp-Natural-Aromatherapy-Herbal-Soap-4-oz-113g/dp/B000146LKS/ref=cm_cr_arp_d_rvw_txt?ie=UTF8"">Patchouli 100% Pure & Natural Aromatherapy Herbal Soap- 4 oz (113g)</a>.  Maybe you might be interested in an Italian bar soap put out by Pre de Provence.  It has a mix of patchouli and rosewood and bergamot:&nbsp;<a data-hook=""product-link-linked"" class=""a-link-normal"" href=""/Via-Mercato-Italian-Soap-Bar-200g-No-1-Patchouli-and-Rosewood/dp/B01JPVO2DA/ref=cm_cr_arp_d_rvw_txt?ie=UTF8"">Via Mercato Italian Soap Bar (200g), No. 1 - Patchouli and Rosewood</a>.  It has a lovely, intriguing and subtle fragrance.

A word on the size of this bar:  I have long fingers, so this large 250g size is not awkward in my hand.  But I can easily see that it might be a problem for smaller hands.  There is patchouli in the 200g size, but not the 150g.  Here is the link:&nbsp;<a data-hook=""product-link-linked"" class=""a-link-normal"" href=""/Pre-de-Provence-Shea-Butter-Enriched-Artisanal-French-Soap-Bar-200-g-Traditional-Fragrance-Patchouli/dp/B000HLEY68/ref=cm_cr_arp_d_rvw_txt?ie=UTF8"">Pre de Provence Shea Butter Enriched Artisanal French Soap Bar (200 g), Traditional Fragrance - Patchouli</a>.","I hoped for a more potent patchouli scent, unfortunately it's not there.  But my skin loves this soap!",1506643200,,
2470,5,True,"08 12, 2016",A80A8PCDT0NFB,B0012Y0ZG2,{'Size:': ' 57'},Royce Lowe,"Used for years, it has DHT blocker",Five Stars,1470960000,,
3,5,False,"05 3, 2011",A2UEO5XR3598GI,B0000530HU,"{'Size:': ' 7.0 oz', 'Flavor:': ' Classic Ice Blue'}",Rich K,"HEY!! I am an Aqua Velva Man and absolutely love this stuff, been using it for over 50 years. This is a true after shave lotion classic. Not quite sure how many women that have been attracted to me because of Aqua Velva,  I do know for sure that it's just to many to count. Ha.  Not sure how long this has been around but the Williams Company ran a paper advertisement, taken from a 1949 magazine, which features Ralph Bellamy of Detective Story and Ezio Pinza of South Pacific for Aqua Velva After Shave Lotion. I'm sure you all remember Ralph Bellamy and Ezio Pinza from the 40's right.

There slogan was "" There is nothing like an AQUA VELVA MAN "" and it seemed to work because this was a hot item when I was a young man. It's just amazing that this is still around when the vast majority of after shave lotions from that time period have disappeared over the years.

The only negative about Aqua Velva is it does not last very long. Usually in less than an hour the aroma has dissipated. The more expensive after shave lotions and perfumes have Ambergris in them which is quite expensive and comes from a sperm whale this enables the aroma to linger much longer.

At any rate this is a great classic after shave with a wonderful refreshing odor, give it a try you might just like it.

Note :::; Some reviewers mention this 7oz size now comes in a plastic container, I just bought one in Wal-Mart and it was glass.",Truth is There IS Nothing Like an AQUA VELVA MAN.,1304380800,25,
2594,5,True,"02 22, 2016",A3BWOPUC4BK90E,B0012Y0ZG2,{'Size:': ' 483'},Amazon Customer,Fast delivery and great product!!!!!!,Five Stars,1456099200,,
425,5,True,"03 8, 2014",AD6WIZKKXYQVL,B00006L9LC,{'Size:': ' 369'},MLawton,This treatment is awesome to reinforce your hair and make it look shinny and healthy. I def recommend it for everybody.,Nice product,1394236800,,
808,5,True,"08 16, 2013",A14YENXHLKG9WL,B0009RF9DW,{'Size:': ' 280'},Samyel F,"this is getting hard  to find.  don't know why -- it's one  of the best scents  for summer that we have ever discovered.  we have the lotion, the wash, and the cologne.",the BEST summer scent,1376611200,,
4610,5,False,"07 12, 2014",A125TMC44CJBKK,B001OHV1H4,{'Size:': ' B-020'},Mustang Shelly,All time favorite!!!! Wish they still carried this!!!,Five Stars,1405123200,,
2323,5,True,"09 6, 2017",A324UOF43Y43WY,B0012Y0ZG2,{'Size:': ' 364'},Amazon Customer,"Great ingredients, but didn't agree with my skin",Five Stars,1504656000,,
279,5,True,"11 13, 2015",A2EB0P9PSMD1M0,B00006L9LC,{'Size:': ' 352'},Amazon Customer,Love the scent. Not overpowering.,Five Stars,1447372800,2,
4168,4,False,"09 22, 2017",ABQWMANK4AR63,B001LNODUS,{'Color:': ' Body Lotion'},JDThird,"Another example of how Amazon throws items together that have nothing to do with each other yet the reviews mix, so it's hard to get an idea of what the review average really means, is it for the lotion, or the water?

THIS review is for the body lotion, which has a slight lavender scent (not too heavy), and is quite creamy.  It goes on evenly and smooth, and absorbs quickly, without any long feeling of greasiness or anything afterwards.  It feels quite nice.","Absorbs quickly, no overpowering scent",1506038400,,
3310,5,True,"09 14, 2017",A1U4MBURSADCDU,B0012Y0ZG2,{'Size:': ' 29'},roxy sox,love this shampoo,Five Stars,1505347200,9,
2822,5,True,"12 15, 2014",A2H99IQJ0JT4MU,B0012Y0ZG2,{'Size:': ' 143'},karen stanley,Love it,Five Stars,1418601600,,
5082,5,False,"09 19, 2017",A2LW5AL0KQ9P1M,B01E7UKR38,{'Color:': ' Take Me To Thread'},Dr. E,"Set aside about forty minutes and take your time with this. So, I waited for my favorite tv show to come on (so I wouldn't be tempted to walk around while waiting for my toes to dry) and began. In total, this is a three step process: apply a coat of color and wait, apply a second coat of color and wait, and finally apply the gel coat and wait. If you take your time, the end product is lovely! Nice color and super shiny!

Now, I know you might be tempted to use a heavier layer of color and then a heavier layer of color for a super rich look. Avoid this. By following the directions and using two regular coats, you are going to get a less streaky and more uniform color. Trust me, if you go a little heavy, it's going to take longer to dry and look clumpy. So, by going the easy route, the product is going to look its best. So, win-win!

This is a hearty polish! It does not chip easily and lasts over one week on fingernails and at least two on toenails! So, this is worth the price.

A fantastic combo! Recommended!","Shiny, Long Lasting, Lovely Look!",1505779200,,
2469,5,True,"08 15, 2016",A280XZUEBJ0G3Z,B0012Y0ZG2,{'Size:': ' 235'},mapster,Absolutely...exactly as described,Five Stars,1471219200,,
4083,5,True,"08 24, 2012",A20Q8XM208DXT1,B0012Y0ZG2,{'Size:': ' 19'},Lloyd,"My hair was falling out, probably because of Psoriasis. Polytar stopped my hair from falling out and most of it grew back. Can't be without this shampoo, no longer available in my province. Thank You Amazon.",Polytar Shampoo,1345766400,,
484,5,False,"12 14, 2014",AIIR8E34EDKCQ,B00021DJ32,{'Color:': ' Super Orgasm'},Kasia S.,"NARS is a treasure for those who get to hold the velvety feeling case in their hand and the blush and eye shadow are my particular favorites here. Super Orgasm by NARS is a glowing, dispersed mash of papaya and raspberry shade with a metallic cloud of shimmer with tiny bits of chunky glitter. That might sound scary but its so wonderfully fine that it looks radiant and as if it was coming from within. For everyday makeup I reach for this no matter what Im wearing or what makeup goes on, it just looks alive even before I have my coffee without looking over done.

 This shade is sultry and sun kissed with this Hollywood Photoshop filler thing going on, it simply looks delicious. I love the whole range and Im also a fan of the NARS Sin  and Orgasm blushes, but this is the best.

- Kasia S.",NARS blush - Super Orgasm shade review,1418515200,,
5248,5,True,"02 28, 2017",A3LR34UDLT38PG,B00VG1AV5Q,,Charity Arnett,"Love Love Love, Very hard to find",Five Stars,1488240000,,
2523,5,True,"05 27, 2016",ATQWHIT4GCWFU,B0012Y0ZG2,{'Size:': ' 370'},Lee Souleles,Excellent product! Excellent transaction.,Five Stars,1464307200,,
349,5,True,"04 7, 2015",A2ITV3AU9TL0O9,B00006L9LC,{'Size:': ' 494'},J. Nguyen,good item...no issues,Five Stars,1428364800,,
4617,5,True,"06 24, 2014",A1XDV760ZLXN57,B001OHV1H4,{'Size:': ' 59'},Patti,I have used this off and on for several years and is great for natural curly hair. Can't find it in any stores so was glad to find it on line. I was told they quit making it.,Curly Hair,1403568000,,
1925,5,True,"10 24, 2014",A22XX80SB8WMUK,B000URXP6E,{'Size:': ' 3'},Chloe,Awesome,Five Stars,1414108800,,
1983,5,True,"06 24, 2014",A1XDV760ZLXN57,B000URXP6E,{'Size:': ' 59'},Patti,I have used this off and on for several years and is great for natural curly hair. Can't find it in any stores so was glad to find it on line. I was told they quit making it.,Curly Hair,1403568000,,
3813,4,True,"12 14, 2014",A2S97Z2I1TFOS,B0012Y0ZG2,{'Size:': ' 25.4 Fluid Ounce'},Gullu&#039;s mom,"Nice shampoo with conditioner. So far, it has not caused any excessive dryness in my hair. Giving it 4 stars as the conditioner part is nothing fancy. My hair don't feel ""well conditioned"" after its use. If you are looking to save time and provide ""some"" conditioning to your hair, this product is good. However, if you are looking for a ""healthy shine"", you should use conditioner separately.",Its okay.,1418515200,,
1751,5,True,"09 10, 2015",A4UCVNYL7GY61,B000URXP6E,{'Size:': ' 8'},Shelly Chao,Love the smell!!!,Five Stars,1441843200,,
2720,5,True,"07 9, 2015",A2LK2NPDGPG9BS,B0012Y0ZG2,{'Size:': ' 70'},Bodekaan,My favorite fragrance.  Subtle but wonderful scent.  Unfortunately can rarely find here.,My favorite fragrance. Subtle but wonderful scent,1436400000,,
4533,4,True,"06 15, 2015",A344ILJPHYQ0V,B001OHV1H4,{'Size:': ' 33'},Yluminada,muy bueno,Four Stars,1434326400,,
4581,5,True,"12 4, 2014",A2XFY9IT8UVY9E,B001OHV1H4,{'Size:': ' 379'},KS,"Really love the product--has made a visible difference in my skin.  Also, seller was great, product arrived MUCH sooner than expected.",Really love the product--has made a visible difference in my skin,1417651200,,
1915,5,True,"11 21, 2014",A1R2A7QAO05UN9,B000URXP6E,{'Size:': ' 305'},Ginny L Morrison,"I love the Bionutrients x 7; it really nourishes my skin.  I am an older adult and the 3x doesn't work for my skin.  Unfortunately, Henkel quit making this product because they said they didn't have a great enough response to it.  I bought over $100.00 worth on Amazon because it can no longer be found in the stores.  I hope I can find something that works as well and I have tried a lot of products.",A Product that Really works...,1416528000,,
3569,5,True,"03 11, 2016",AOMVFFY4OPSPQ,B0012Y0ZG2,{'Size:': ' 11 fl. oz.'},Amazon Customer,Worked great!,Five Stars,1457654400,,
4897,5,False,"08 31, 2017",A2WW57XX2UVLM6,B00W259T7G,"{'Size:': ' 250 Gram', 'Color:': ' Rosemary Mint'}",Talvi,"I love my soaps and this one is excellent.  It has a nice clean rosemary mint scent that doesn't smell 'fake' as so many do.  There are little bits of mint in the soap you can actually see but won't stick to you when washing.  I prefer French milled because they lather easily and are smooth - cheaper soaps never lather easily and you have to spend forever trying to get enough on your hands.  The shea butter leaves skin moisturized but not sticky or feeling like there is a residue left after exiting the show.  In all, I'm very pleased!",Nice Quality Soap,1504137600,,
2901,5,True,"07 4, 2014",A1UMO57A3IQGT7,B0012Y0ZG2,{'Size:': ' 329'},rjon,A gift that was appreciated by the receiver.,Five Stars,1404432000,,
428,5,True,"02 4, 2014",A31XUJMEDBUGKR,B00006L9LC,{'Size:': ' 23'},Terry V.,"Beautiful Beginnings have been the answer to my prayers when it comes to my daughter's very thick and curly hair. The shampoo, Detangler and Conditioner work like a charm together. Her hair was breaking too much prior to me using these, not, I only get a few strands when am all done washing and combing her hair. I can't seem to find them in the local Sally Beauty Supply nor grocery stores. Highly recommend!",Works great!,1391472000,,
4568,5,True,"01 13, 2015",A154MPHVRSZVQN,B001OHV1H4,{'Size:': ' 16.9 oz.'},Judy Friedman,"I have been using this shampoo  for years,  I  was first introduced to it in Madera in the early 90's and for  some years had them ship me the product until I found a way to order in the U.S.

  I am 74 years old and have very thick hair which most people my age would love to have as well as  a lot of young people, I believe using the right products may contribute to less hair loss.

I  have  been told you should not use the same shampoot all the time and switch every once in awhile and whenever I have tried other shampoos I immediately come back to  Kerastase.

 It is truly a wonderful shampoo",I am 74 years old and have very thick hair which most people my age would love to have as well as a lot of young ...,1421107200,,
1953,5,True,"08 19, 2014",ARI1N006KSXX,B000URXP6E,{'Size:': ' 13'},Jennifer,I love this hair cream! It has a nice subtle scent that isn't overpowering and it is very lightweight.,Great everyday styling cream,1408406400,,
2476,5,False,"07 30, 2016",A2UH411RVKUH96,B0012Y0ZG2,{'Size:': ' 143'},Barb,"Have used this for over a month and I love it! No more itching or burning of my skin. Along with the Olay Age Defying moisturizer, my skin feels smooth and non-greasy. Lovely light scent too.",Love it,1469836800,,
2120,5,True,"06 2, 2013",A2WA0B9CJ28E45,B000URXP6E,{'Size:': ' 7'},Rainy,"Great hair care products always leave my hair feeling clean and soft, ive tried a lot of products but these are my favorite",Biolage,1370131200,,
5255,5,False,"05 5, 2016",A3ETTJOVI6C9V5,B019LAI4HU,,W. Keane,"I LOVE the smell, the texture, everything about it!!!  This is my absolute favorite.  I want the body lotion, but you usually can only find it in a set.  I just want the lotion, I have two bottles of perfume, just to get the lotion.  It's wonderful.",I LOVE the smell,1462406400,,
1703,5,True,"01 16, 2016",AOZV8VU33NLG8,B000URXP6E,{'Size:': ' 203'},Darlene M.,What I expected Nice,Five Stars,1452902400,,
2952,5,False,"01 5, 2014",A36LNAKD2FOHVX,B0012Y0ZG2,{'Size:': ' 181'},Heather Marie Levan,I recently had this amazing citrus salad from Whole Foods and this body wash is every bit as yummy!  I don't recommend eating it of course but I highly recommend it in the morning to wake the senses.  Refreshing!,Citrus Salad,1388880000,,
1944,5,True,"09 6, 2014",A2UNM0QKAA0LUS,B000URXP6E,{'Size:': ' -'},Peggy Brothers,Great! large enough for excellent coverage...love it!,Face Powder Brush,1409961600,,
4539,5,True,"05 25, 2015",A1KEYDA4M5GDSH,B001OHV1H4,{'Size:': ' 5'},Angela S. Carson,"really cleans my hair with a fresh smell, will buy again",Five Stars,1432512000,,
616,5,True,"11 19, 2015",A1MCIV8P5COBQZ,B0009RF9DW,{'Size:': ' 129'},Justin Kitchens,Smells AMAZING. Worth buying,Worth,1447891200,,
2041,5,True,"12 15, 2013",A1IMRCSU4F0409,B000URXP6E,{'Size:': ' 367'},Bdot,Packaging was nicely done with bubble wrap and paper. Box is amazing besides perfume and I love the new red door design. Order this one because im used to the old bottle design which they sent the new one and im glad they did.,Happy,1387065600,,
1584,5,True,"07 1, 2016",A1P5CYOPKV31LU,B000URXP6E,{'Size:': ' 74'},Yessi Islas,Love the smell & lathers easily so you don't need much. Has lasted me for a while now & will definitely be buying again!,Definitely recommend!,1467331200,,
1565,5,True,"07 18, 2016",A1LV8TM9ICX1IX,B000URXP6E,{'Size:': ' 4-piece Gift Set'},Cordia,I love musk cologne and it is not easy to find so I bought these.  I like all the scents but the original musk is my favorite.,I love musk cologne and it is not easy to find ...,1468800000,2,
1311,5,False,"05 13, 2018",A320TM0B7A5Q1C,B000URXP6E,{'Size:': ' Small'},ray mcconaghy iii,"Wow, this product really is purely organic and natural! Outstanding vegan ingredient list and no chemical additives. Works perfect, suits my dry hair.",Great and natural,1526169600,,
4729,5,True,"01 4, 2015",A2NN6H2RZENG24,B000FOI48G,,Robert C Ross,"After extensive dental work including a seven tooth upper implant, I found flossing impracticable. My dentist suggested using this unit twice a day, and after two months it works perfectly.

It was a little tricky learning to start it in my mouth and then letting the water drizzle out without splattering, but time and habit solved everything.

Just had my three month checkup and everything was sparkling clean around both the implant and my remaining teeth.

One small amusement: the carrying case has holders for four tips but the unit comes with six. Luckily the fifth wheel, as it were, fits in the carrying case even though there is no slot for it.

Swish and pik away!

Robert C. Ross
January 2015",Works great,1420329600,,
5229,5,True,"10 11, 2016",AIG1G1AKH7JVB,B00RZYW4RG,,Amazon Customer,Best stuff ever!  Makes my hair less frizzy when using with a flat iron.  Makes it soft & silky.  Highly recommend!,Best stuff ever,1476144000,,
1478,5,True,"01 15, 2017",A1S7I4K5PNOUDD,B000URXP6E,{'Size:': ' 1 Pound'},Sue,Google the uses and you will be a buyer.,Five Stars,1484438400,,
3973,5,True,"10 26, 2013",A4DEEDXZK8L78,B0012Y0ZG2,{'Size:': ' 205'},Gloria Karimi,This is a beautiful scented lotion.  Very moisturizing and scent is perfect. I will order again when I run out.  It matched perfectly to the perfume.,Beautiful Scent,1382745600,,
713,5,True,"10 25, 2014",A1AWB5QE4T9LPM,B0009RF9DW,{'Size:': ' 7.6oz'},Rafael Saturno,All perfect,Five Stars,1414195200,,
1784,5,True,"08 6, 2015",A2F9G1A29XS38E,B000URXP6E,{'Size:': ' 248'},WCastro,"excellent product, as described",Five Stars,1438819200,,
2597,5,True,"02 21, 2016",A2DK8CVJ2HYDRI,B0012Y0ZG2,{'Size:': ' 36'},Pamela Biafora,Works great for hair thats thin.  Wish Walgreens kept it on the shelf.,Five Stars,1456012800,,
3798,4,True,"01 12, 2015",A244RDHGOX4Z2J,B0012Y0ZG2,{'Size:': ' 57'},Dinorah Navarro,It's the best shampoo I've ever tried! It didn't stop my hair loss 100% but I can see a big difference! I bought 3 and after I ordered again...,It's the best shampoo I've ever tried,1421020800,,
5196,5,True,"05 25, 2016",A1GVTXX0S7ANZ8,B00IJHY54S,,Amazon Customer,I absolutely love this product and buy for myself and all of my friends.  Can't say enough about these.,Five Stars,1464134400,,
380,5,True,"12 4, 2014",A30EPPTPW7M9D0,B00006L9LC,{'Size:': ' 410'},Lennie,Excellent product!  Received in good time.  Thank you!,Excellent product! Received in good time,1417651200,,
1659,5,True,"03 8, 2016",AVC2FIYKB6VHF,B000URXP6E,{'Size:': ' 1'},emily prentice,:),Five Stars,1457395200,,
486,4,False,"11 14, 2013",A3E5V5TSTAY3R9,B00021DJ32,{'Color:': ' Orgasm'},Rather be at the Beach,"This is truly a high quality blush.  It goes on smoothly and doesn't need a touchup until, maybe, late afternoon.  So you really do use very little.  There are such beautiful colors from which to choose.  I recommend it.",A Gorgeous Blush,1384387200,,
3082,5,True,"02 8, 2013",A31W4OHQPNCNKY,B0012Y0ZG2,{'Size:': ' 444'},Sandi Mc,"it is a mauve with shimmer.  I knew this because I have bought it before but the picture on the site looks more like a peach color.  I have been trying to find this everywhere and finally thought to look here at Amazon.  I am so glad I was able to find it.  I would suggest that you retake the picture though as it is more of a dark mauve with shimmer than what the picture suggests as a peachy color.  Thanks,",mauve eye shadow by Covergirl (Aubergine Queen - #530),1360281600,,
1302,5,True,"02 17, 2013",A1LNES65GKVL0C,B000URXP6E,{'Size:': ' 46'},Amy C.,I bought this for my daughter.  Burt's Bees stuff is always good quality.  She is happy with it.  Smells nice.,Burt's Bees Shower Kit,1361059200,,
2008,5,True,"03 18, 2014",A3B9T1GXSEVIWM,B000URXP6E,{'Size:': ' 113'},Miss D,"Love the way Old Spice High Endurance Body Wash, Pure Sport smells. Gets you clean, classic product that is very effective",Smells great,1395100800,,
2870,5,False,"08 28, 2014",A3U05BH8UYBNLE,B0012Y0ZG2,{'Size:': ' 1.7 oz'},Doa Kim,Nice and my mom likes it,Five Stars,1409184000,,
4330,5,True,"12 8, 2016",A23ZC494ZWNEE0,B001OHV1H4,{'Size:': ' 84'},Amazon Customer,This is a great product. I have been using it since two years ago. It is very gentle on your hair!,This is a great product. I have been using it since two ...,1481155200,,
2568,5,True,"03 17, 2016",A34SO74JEYQXZW,B0012Y0ZG2,{'Size:': ' 39'},Jose,"Sally's stop selling this great shampoo for fuller thicker hair thanks to this company through Amazon I can buy again. This is a great shampoo if you want to hide that you have thin hair, but this shampoo only gives volume for a few hours.",Fuller Hair,1458172800,,
1449,5,True,"03 5, 2017",A36CT6022EC8KS,B000URXP6E,{'Size:': ' 468'},Amazon Customer,Smells great!! Thanks for the fast delivery!,Five Stars,1488672000,,
629,5,True,"09 5, 2015",A1B5D7AI4KYG98,B0009RF9DW,{'Size:': ' 290'},Al hermosillo,Very good stuff,Five Stars,1441411200,,
3570,5,False,"03 8, 2016",A345PQ5PIJVC67,B0012Y0ZG2,{'Size:': ' 53'},Bridget Schoff,"AS awesome as this product is, it HAS been discontinued by the makers. The people selling this on here, including the shampoos and conditioners ARE price gouging you and who knows how OLD it is..  Very Sad",AS awesome as this product is,1457395200,,
1077,5,False,"01 3, 2015",A3TFW9R3OCAGUI,B000FI4S1E,,ali alawieh,I love the smell of the shower gel also it bodyspary and also a great gift set that I got from wife that only cost me $20. it's great to a get gift from your hard own money.,I love the smell of the shower gel also it bodyspary ...,1420243200,,
5260,5,True,"05 4, 2017",AKQ9DH3HRPHW3,B019V2KYZS,,Anuschka Light,"This is just adorable compact fragrance. It comes in a gorgeous silver compact. A cute carry pouch. And to my surprise- a refill. I am Uber pleased with this purchase. Oh and the D&G Lifht Blue is one of my forever favorite fragrances.

Love",Love Love Love!!!!,1493856000,4,
1933,5,True,"09 30, 2014",A41D5III07SB6,B000URXP6E,{'Size:': ' 5'},MARYSTAR,Love this!,hair,1412035200,,
4947,5,True,"12 25, 2014",A1MHFSMKSOED47,B00W259T7G,"{'Size:': ' 250 Gram', 'Color:': ' Agrumes'}",Yasmin,great. Thank you,Five Stars,1419465600,,
1185,5,True,"08 26, 2013",A1AFSSJ58HYER7,B000FI4S1E,,HIPRICE,"I love this gel, it makes my bedroom smell great, as well as me.  Love it, love it, love! Need to buy more!  Thank U!",GREAT BUY!,1377475200,,
1513,5,True,"11 3, 2016",ASL42Q7LYJWFV,B000URXP6E,{'Size:': ' 74'},Janet Roseblatt,Tried many but this is the one to buy.,A favorite shower bathing gel.,1478131200,,
3045,5,True,"05 19, 2013",ADEFD8L3I7YFR,B0012Y0ZG2,{'Size:': ' 100'},Amazon Customer,"The scent is very unique and luxurious. Very Euro...it combines the cleanness of modern scents with something ancient. I bought it for my husband, but i secretly love it for myself. I wish I had the cologne, but it cant be shipped to my FPO address.",I love the luxurious scent..,1368921600,,
4097,5,False,"09 5, 2012",A2LY3LPGRERLPW,B0012Y0ZG2,{'Size:': ' 71'},finicky buyer,"I had a hard time finding this product in the stores in my area. I was finally able to find it and I love it. My skin is so soft, not greasy or feeling like I need to take another shower to get it all off like so many body washes that I have used before. I have stocked up on this stuff just in case they decide to get rid of it in my store. I would highly reccomend this product to anybody that has dry itchy skin or any texture problems like I had. I no longer need to use heavy lotion and my skins clarity is much better.",another love for St. Ives,1346803200,,
1819,5,True,"06 3, 2015",A1OIRJ1W4N8CW,B000URXP6E,{'Size:': ' 206'},Laura Ferradino,"I really love this product!  My skin was so dry and flaky, but now it is as smooth as silk. I will be buying again.",I really love this product,1433289600,,
2453,5,True,"09 24, 2016",A3RUBIOZYJNY0D,B0012Y0ZG2,{'Size:': ' 122'},Merrie,thank you,Five Stars,1474675200,,
3356,5,True,"03 20, 2017",A1SY26REK8411L,B0012Y0ZG2,{'Size:': ' 177'},Run2Daylite,Stops man stink in its tracks.,babes dig it,1489968000,6,
2647,4,True,"11 10, 2015",A1M54T56FE4B86,B0012Y0ZG2,{'Size:': ' 4'},AmazonFan,"I really like these products - I saw some folks talked about ""slowed"" grey growth.  I haven't really noticed that.  But my hair seems less frizzy when I use this product.",I really like these products - I saw some folks talked about ...,1447113600,,
