,overall,verified,reviewTime,reviewerID,asin,style,reviewerName,reviewText,summary,unixReviewTime,vote,image
4920,4,False,"08 28, 2017",A2O421DTA8J0RW,B00W259T7G,"{'Size:': ' 250 Gram', 'Color:': ' Tiare'}",Dogs &amp; Horses ,"I have the tiare scent of this bar soap. It's not a scent that I can easily break down. It makes me think of brown sugar, lavender and coco butter. The scent is way too sweet for me, but it doesn't linger long.

The soap itself is smooth and lathers pretty well. It is very soft, feels nice on the skin and does actually clean you off. I found that I needed to rinse a little more than usual to get the last residue of it off though. (We don't have soft water) I like this, but I am not convinced it's any better than a regular soap for a lot less money.","Sweet scent, lathers & cleans fine. Too rich for my budget",1503878400,,
2540,5,True,"04 29, 2016",AQG3FO72CYLU3,B0012Y0ZG2,{'Size:': ' 1'},michael dzienis,can't beat it... 3 for the price of 1 at a local store,Five Stars,1461888000,,
2633,5,True,"12 23, 2015",A2S696CI415O20,B0012Y0ZG2,{'Size:': ' 11 fl. oz.'},Q.C. Stickler,I'm a fan!,I'm a fan!,1450828800,,
4192,4,False,"09 2, 2017",A7C77J4MH94B6,B001LNODUS,{'Color:': ' Lavender Blossoms'},Maxwell Edison,"I'm reviewing the dried lavender blossoms. The scent is wonderful, so long as you like the scent of lavender -- and I do. I mix this with some dried flower petals and use it as potpourri in the restroom. It's not an immediately overwhelming scent, but when you walk into the room, it smells very nice. In the fall, I'm going to mix it with some ground cloves.

I'd give this five stars if it were just a bit less expensive. It's not overpriced, but it's not a steal, either. Overall, though, I'm happy with it.",Potpourri material,1504310400,,
4664,5,True,"07 4, 2013",A3IVDKJ8B51LO0,B001OHV1H4,{'Size:': ' 366'},Penney Hill,Would buy more of the body cream if moire was available.  This body cream is hard to come by.  I buy anytime I find on a site.  Lotion is easily available but the body cream is difficult to obtain.  This is my signature fragrance.,Best Product,1372896000,,
585,5,True,"05 6, 2016",A12X146LZM6KM0,B0009RF9DW,{'Size:': ' 17'},eieio,"Great scent, and no sulfates.",Five Stars,1462492800,,
3021,5,True,"08 2, 2013",A3AF038W92E3I,B0012Y0ZG2,{'Size:': ' 432'},Hismai,"My hair feels soft after I started use them. They smell wonderful! If you are like me, asian, with lots of thick hair, that are prone to frizz, I think for this prize, it's worth trying them!",Great!,1375401600,,
2352,5,True,"04 25, 2017",A37C3532V0OGK4,B0012Y0ZG2,{'Size:': ' 79'},Henrietta,"Took care of my flaky scalp, a problem I've had for years.",Highly Recommend,1493078400,,
864,5,False,"09 5, 2012",A2LY3LPGRERLPW,B0009RF9DW,{'Size:': ' 71'},finicky buyer,"I had a hard time finding this product in the stores in my area. I was finally able to find it and I love it. My skin is so soft, not greasy or feeling like I need to take another shower to get it all off like so many body washes that I have used before. I have stocked up on this stuff just in case they decide to get rid of it in my store. I would highly reccomend this product to anybody that has dry itchy skin or any texture problems like I had. I no longer need to use heavy lotion and my skins clarity is much better.",another love for St. Ives,1346803200,,
2593,5,True,"02 22, 2016",A3S5MHB0P2RTI5,B0012Y0ZG2,{'Size:': ' 177'},D. James,"The soap is great, I only wish it was available in stores.  It's a little on the pricey side considering it's from Dial, and not some French, or Italian desinger, but when you seemingly can only get it online it's worth it.","The soap is great, I only wish it was available in stores",1456099200,,
2909,5,False,"06 19, 2014",AX5SY5C2R0LRV,B0012Y0ZG2,{'Size:': ' 286'},Tangela,"""Oh my goodness"".. This is the most wonderful body wash ever.. It has to be the best thing since herbal essences.. at least the Japanese version, and i'ts peach.. Oh my God, it smells so good. You'll never want to get out of the shower.  I used it all up in like a week. It was like addictive. I love it. 5 stars... I'll buy it again and again I can't get enough of that smell!","""Absolutely wonderful""",1403136000,,
3027,5,True,"07 18, 2013",AYORX1AK30JMB,B0012Y0ZG2,{'Size:': ' 191'},Westy,"Great product! I use it on my face, neck and arms after shaving. My skin feels great and my eyes don't sting when I perspire.",Nice!,1374105600,,
3564,5,False,"03 14, 2016",A1NP1AD8FGSA71,B0012Y0ZG2,{'Size:': ' 586'},mercedes,I get more compliments when I wear this lotion!!!,Very Clean Scent,1457913600,,
3266,5,False,"04 7, 2018",A31URN5S2Q0UJV,B0012Y0ZG2,{'Size:': ' Small'},Boris Jones,"Was skeptical at first. The liquid is kind of runny. However, it is absolutely awesome performance wise. Hands down the best shampoo out there. Smells great, cleans hair great and stopped me from scratching my head after using this product for a couple of times.",Awesome quality!,1523059200,,
1498,5,True,"12 9, 2016",A2X7VCBZQROXVM,B000URXP6E,{'Size:': ' 6'},Amazon Customer,I love this product. Really makes my hair moisturized and silky,Five Stars,1481241600,,
4674,5,True,"02 18, 2013",A2ZSMS6M1Q4Y9R,B001OHV1H4,{'Size:': ' w-087'},Barbara S,Smells great with out the allergy issues.  I wish I didn't have to have required number of words.  What more can I say about soap?,No allergy problems w/this soap.,1361145600,,
110,5,False,"01 21, 2017",A3IGHIOZ898AWG,B00006L9LC,{'Size:': ' 28'},Julie,"This shampoo is so refreshing! I love how clean and tingly it makes my scalp feel, and it smells really good, too!",Love this refreshing shampoo!,1484956800,,
1976,5,True,"07 6, 2014",A105A034ZG9EHO,B000URXP6E,{'Size:': ' 180'},K. Mras,yum,Five Stars,1404604800,,
1942,5,True,"09 11, 2014",A265E2JC4S3YWC,B000URXP6E,{'Size:': ' 17'},Yngathrt,This product is wonderful and the seller met  my every expectation!,Five Stars,1410393600,,
983,5,True,"02 22, 2016",A3S5MHB0P2RTI5,B000FI4S1E,,D. James,"The soap is great, I only wish it was available in stores.  It's a little on the pricey side considering it's from Dial, and not some French, or Italian desinger, but when you seemingly can only get it online it's worth it.","The soap is great, I only wish it was available in stores",1456099200,,
4011,5,True,"08 2, 2013",A3AF038W92E3I,B0012Y0ZG2,{'Size:': ' 432'},Hismai,"My hair feels soft after I started use them. They smell wonderful! If you are like me, asian, with lots of thick hair, that are prone to frizz, I think for this prize, it's worth trying them!",Great!,1375401600,,
970,5,True,"04 29, 2016",A2O4T6MQ540AGF,B000FI4S1E,,Brandon Meekins,Fast shipping and just as described.,Five Stars,1461888000,,
509,5,True,"12 15, 2017",A1X15KWJ11IC1P,B0009RF9DW,{'Size:': ' 144'},Mert Ozer,"Lovely product and works great, except the artificial coloring :(",Five Stars,1513296000,,
1075,5,True,"01 12, 2015",A3UE3Z1GP28DRW,B000FI4S1E,,nila a. vehar,"This is perfect in many ways, fragrant, light, and clean.",Five Stars,1421020800,,
1171,5,True,"11 11, 2013",A1DFZPQPCHBYTY,B000FI4S1E,,Sean Love Racing LLC,"Found this stuff in Japan and wondered if I could find it again. 3drops of it goes as far as a handful of normal soap, it stays foamy and soapy and has a nice scent!",Super lathery nice soap!,1384128000,,
4193,4,False,"09 1, 2017",A1M1Y5UGONAW06,B001LNODUS,{'Color:': ' Lavender Blossoms'},Jody,"Who doesn't love the fragrance of lavender?  This is a large cellophane bag of the dried blooms, which look a bit like brown rice.  The fragrance is strong, even before opening the bag.  Little bowls of this placed around the house provide a lovely fresh atmosphere without being overpowering.  The 5.3 ounces is about two cups.

If you're looking for dried flower blooms for scented decorations, this isn't your product.  It's not pretty, but it does smell wonderful.  I'm waiting for someone to ask why I have a dish of rice on my coffee table!",Heavenly fragrance,1504224000,,
89,5,True,"03 20, 2017",A1MZIY3MPR5LRS,B00006L9LC,{'Size:': ' 1000ml/33.8oz'},Amazon Customer,love it,Five Stars,1489968000,,
147,5,True,"10 11, 2016",A2PUZMHH482FU7,B00006L9LC,{'Size:': ' 266'},inparadise,Love this stuff - i'm on my second order. Started to get thinning hair. now there's whisps where there wasn't any and hair feels thicker all over.,love this stuff,1476144000,,
2525,5,True,"05 26, 2016",A3OCG4F2HKKPD5,B0012Y0ZG2,{'Size:': ' 494'},Linda  Atwood,like it,Five Stars,1464220800,,
1469,5,True,"01 22, 2017",A23ALLEUZQKAR1,B000URXP6E,{'Size:': ' 500ml'},NeNeBe,My granddaughter loves the fragrance.,Great fragrance,1485043200,,
1969,5,False,"07 14, 2014",A3HHQ7UIJJAOAV,B000URXP6E,{'Size:': ' 179'},redlin51,I love this for when I take a shower.,Five Stars,1405296000,,
3468,5,True,"07 26, 2016",A3Q6RS3X7VRVW3,B0012Y0ZG2,{'Size:': ' 255'},Nick Nasc,Been a fave for decades,Five Stars,1469491200,,
4974,5,True,"07 19, 2013",A3NFZN1GS1RKR9,B00W259T7G,"{'Size:': ' 250 Gram', 'Color:': ' Green Tea'}",Mintea,"Long lasting, high quality soap, wide spectrum of scents... Leaves skin incredibly soft and fragrant. Pricey, but worth every penny",Excellent Product,1374192000,,
2002,5,True,"04 7, 2014",A2TY2IK21P4498,B000URXP6E,{'Size:': ' 196'},kimmi,I GOT TO GET SOME MORE BECAUSE MY BATHS ARE BECOMING KINDA LAME WITHOUT THIS LIQUID SOAP SO FOR NOW I AM OKAY,THIS IS THE BEST,1396828800,,
3541,5,True,"04 14, 2016",AL24GOJZZ48PB,B0012Y0ZG2,{'Size:': ' 174'},S. Rae,As expected for price.,Five Stars,1460592000,,
260,5,True,"01 24, 2016",A1WMNCCFKM2A4Z,B00006L9LC,{'Size:': ' 108'},Bill Ummel,Great product great price,Five Stars,1453593600,,
2256,5,True,"04 22, 2018",A1L0QECT7J93ZP,B0012Y0ZG2,{'Size:': ' 8.5oz'},Elena,"Great body wash for sensitive skin. Definitely works for me. Leaves skin moisturized and clean. Will repurchase for sure.
PS: the candy scent is very pleasant as well.",Great!,1524355200,15,['https://images-na.ssl-images-amazon.com/images/I/71R1a7bU1IL._SY88.jpg']
2149,5,True,"02 27, 2013",A3CB8QT4E8R232,B000URXP6E,{'Size:': ' 31'},Broker,This is likely the best shampoo and conditioner that I have bought in recent years. Goes will with the hair gel that they sell as well. Happy with my purchse.,Great!,1361923200,,
2845,5,True,"10 28, 2014",A30VYJQW4XWDQ6,B0012Y0ZG2,{'Size:': ' B-002'},michelle,"These refill intense reinforcing treatment , left my hair smooth and smell good! I like.",Vector fill intense reinforcing treatment .,1414454400,,
1081,5,True,"12 24, 2014",A1SW8WT1S0GHQV,B000FI4S1E,,CJ,I really appreciate the rapid delivery on my item. It was better than expected.,quick delivery,1419379200,,
525,5,True,"05 16, 2017",A3VUYRFM95CGJR,B0009RF9DW,{'Size:': ' 160'},Valentina V.,Thank you.,Five Stars,1494892800,,
2659,5,True,"10 17, 2015",A3NY63XTSMNUVZ,B0012Y0ZG2,{'Size:': ' 4'},Natasha rivera,Amazing product!!!,Five Stars,1445040000,,
152,5,True,"09 19, 2016",AE051QZ4E3BPX,B00006L9LC,{'Size:': ' 50'},Debra A Marcks,Received product in a timely fashion and am pleased.,Shampoo,1474243200,,
4352,4,True,"09 21, 2016",A2WNVJ6S7OVZP4,B001OHV1H4,{'Size:': ' 15'},Amazon Customer,It worked very well i disliked nothing,Four Stars,1474416000,,
4301,5,True,"02 14, 2017",A3GM8H7MO9I4H7,B001OHV1H4,{'Size:': ' 120'},edazzle,Excellent product,Five Stars,1487030400,,
3532,5,True,"04 26, 2016",A1ZH9XEBQIPLWT,B0012Y0ZG2,{'Size:': ' 505'},JOYCE SCOTT,love them,Five Stars,1461628800,,
2507,5,True,"06 30, 2016",A1V9QLYRT1O4KF,B0012Y0ZG2,{'Size:': ' 192'},Amazon Customer,The product arrived as promised and in good condition.,Five Stars,1467244800,,
5254,5,True,"05 6, 2016",A2KV46HMWY1YWB,B019LAI4HU,,Kindle Customer,"Smells wonderful. Feels great on hands and arms, etc.",Must have product,1462492800,,
416,4,True,"06 28, 2014",A3KHIT48AYHC0L,B00006L9LC,{'Size:': ' 5'},DLB,Have used this product for the past 7 months. It has proven to be a great shampoo by improving the overall health of my hair.,H2O+ aquatics natural shampoo,1403913600,,
217,5,True,"04 12, 2016",A39JMSWQA06ZN6,B00006L9LC,{'Size:': ' 5 oz.'},Bettina Janet Mc Laughlan,Beautiful hair after use...shiny !,Five Stars,1460419200,,
5080,5,False,"09 23, 2017",A5BJMAHZWGJ7N,B01E7UKR38,{'Color:': ' Rock The Runway'},Melaina Lara,"Rock the Runway is another winning red from the Essie Gel Couture line. I love the wide, curved brush which makes application effortless. I also love the fact that it doesn't need a base coat, and dries incredibly fast.
It's the cheeriest of cherry reds, bright, bold and yet classic.
I get pretty long wear time, not 14 days but still longer than a traditional polish on my working fingers. And even then, it's usually because of tip wear or grow out, not because the polish has chipped.
For the price, this is my go to polish. Love it!!",Rock this red,1506124800,,
158,5,True,"08 26, 2016",A26FGQS4JIPDH5,B00006L9LC,{'Size:': ' 281'},Linda Willford,My son also likes this,smells great,1472169600,,
2446,5,True,"10 17, 2016",A38EDCGATXMRI3,B0012Y0ZG2,{'Size:': ' 13 Fl. Oz'},Amazon Customer,Good Stuff!,Good Stuff!,1476662400,,
2988,5,True,"10 10, 2013",A3T466V6635L3Z,B0012Y0ZG2,{'Size:': ' 113'},Ali Ayyash,"This is the best body wash I've ever used. I use it every day and it's the only body wash that leaves my body smelling good for a prolonged period of time, and at the same time reduce the greasiness of the skin.",You'll feel clean and smell good.,1381363200,,
4153,4,False,"08 11, 2016",AGEKVD8JPZQMT,B001ET7FZE,{'Style Name:': ' Bubble Fruit'},Matt,"My kids (5 and 7) really like this toothpaste.  They said it tastes better than the ""adult stuff"" that we usually use.  The pump top is nice b/c it sits firmly on the counter and makes it easier to get some on the brush head without making a big mess like they do with the squeeze tubes.  Overall, very good for the kiddos",Good kids' toothpaste,1470873600,,
5226,5,True,"06 30, 2015",A193RG4GIJ5OLM,B00QXW95Q4,,Kindle Customer,Love it. Makes my hair just lovely and curly.,Five Stars,1435622400,,
1865,5,True,"02 26, 2015",A2R03U5UAX219B,B000URXP6E,{'Size:': ' 119'},Avid Leigh,Favorite scent! Love it!,Favorite scent ever!,1424908800,,
1700,5,True,"01 19, 2016",A3VJQ5WRH77UKU,B000URXP6E,{'Size:': ' 92'},Kathy L,Does a great job of volumizing and is gentle on my hair.,White Rain is an old and trusted shampoo for me,1453161600,,
4815,5,True,"03 8, 2016",AVC2FIYKB6VHF,B00RZYW4RG,,emily prentice,:),Five Stars,1457395200,,
1480,5,True,"01 7, 2017",A2B33XXX3MZC6R,B000URXP6E,{'Size:': ' 49'},Tom Waters,Great comb! Very well made and the wood even has a nice scent. Pairs well with Northern Fir's beard oil!,Another quality product from Northern Fir,1483747200,,
4927,5,True,"05 9, 2016",A1GTSEGAXWRSO8,B00W259T7G,"{'Size:': ' 150 Gram', 'Color:': ' Raspberry'}",AlwaysTruth#1,"Laid in my BATHROOM ON DISH ENTIRE ROOM SMELLS AMAZING.  I LOVE IT!  Bought more!
Love these Soaps and the Company whom makes them! All are amazing.
Here is a Wonderful list to help everyone choose there favorite Scents!
Like helping other's.
Pre de Provence Pure Vegetable Oil Soap - 8.8 oz. bar

With luscious scents and rich lather, these soaps are a customer favorite. Hard-milled to be long-lasting, with Shea Butter and Pure Vegetable Oils to moisturize your skin. Delicately scented and made with all natural ingredients. Individually wrapped bars.

Agrumes (Citrus Fruits) Light citrus blend of grapefruit, citron, and orange.
*Angel's Trumpet Sunny, floral fragrance. Exfoliating.
Apple Pear Summer day in the orchard; fresh and fruity.
Coconut Luscious... The fragrance of the islands.
Green Tea Exotic, sensuous, and tangy.
*Honey Almond Honey and Almond blended into the warm, sweet smell of Provence. Exfoliating.
Jasmin Exotic & floral.
*Juicy Pomegranate Fresh, juicy sweet. Exfoliating.
*Lavender Lavender, the best alternative to a trip to the south of France! Aromatic & woody. Exfoliating.
*Lemongrass Tangy, citrusy, and invigorating. Exfoliating.
*Lime Zest Earthy, citrusy zeal of the lime. Provides the well being of cheer and revitalization. Exfoliating.
Linden Sweet essence of a summer day in Provence. Fresh & clean.
Milk Clean, sweet, and pleasing.
*Mint Leaf Invigorating, refreshing, and restorative. Exfoliating.
Mirabelle Juicy, green floral
Moondance Bright, green, floral
Olive Oil Mild scent, highly moisturizing & non-allergenic. The very best for dry or sensitive skin.

Also good as a baby soap, shaving soap, laundry soap, or kitchen soap.
Peony Subtle, sensual, powdery, and romantic.
Pineapple Scrumptious... Sweet and fruity.
Raspberry Juicy, sunny
*Rose Petal French rose garden in summer. Exfoliating.
*Rosemary Mint Fresh, herbaceous
*Sage Herbal, fresh, and exhilarating. Exfoliating.
Starflower Sparkling, fruity, floral
*Tiare Tropical, creamy floral. Exfoliating.
Verbena Sparkling citrus to excite the senses.
Violette Sugared violets
*White Gardenia A beautiful shrub with fragrant white flowers that create a sweet, silky floral. Exfoliating.

* Asterisks in the list above indicate soaps with exfoliating visible bits of lavender blossoms, rose petals, apricot rind, lemongrass, sage and mint leaves. Along with the richness of shea butter, these botanicals help to exfoliate dead skin cells leaving skin renewed and soft.",PERFECTION SMELLS SIMPLY BEAUTIFUL MY FAVORITE RASPBERRY,1462752000,2,
1281,2,False,"06 26, 2009",A3R9H6OKZHHRJD,B000LIBUBY,"{'Size:': ' 3.4 fl oz', 'Scent Name:': ' Redcurrant Basil'}",LH422,"I was really hoping this scent would be true to it's name, and that it would smell of redcurrant and basil.  Wearing it, I smell neither one of those scents (both of which I love); it just smells generically perfumey on me.  I love the idea of a redcurrant/basil scent, but this is not it.  Your mileage may vary of course, but I highly recommend a test run before buying.",Didn't smell like redcurrant and basil to me,1245974400,,
526,5,True,"04 24, 2017",A2F218M5AOPU6T,B0009RF9DW,{'Size:': ' 198'},Tony,Great product..,Five Stars,1492992000,28,
3110,5,True,"08 8, 2012",A1WIWSI84T3543,B0012Y0ZG2,{'Size:': ' 256'},Bustermamaw,"I LOVE this product.!! It feels so good on your skin.
I tried to order again and was told they didn't know when or if they would get it back.
I would give this this a #5!!",Love this Body Souffle,1344384000,,
3951,5,True,"12 18, 2013",AUYOTOM5XVNL,B0012Y0ZG2,{'Size:': ' w-087'},Lou,"Makes my facial pores smaller and I swear  that my wrinkles seem less obvious around my eyes.  Much appreciated
since large pores run in the family.",Does a really great job,1387324800,,
3495,5,True,"07 2, 2016",A1L887BYCTVXH6,B0012Y0ZG2,{'Size:': ' 463'},Aidan D.,Miami is my favorite,Five Stars,1467417600,,
2157,4,False,"12 18, 2007",A28N2AWOVO2PB,B000V5Z4J6,,Simon Cleveland,"You know how annoying it is to keep in mind that every 30-45 days you must throw away your old toothbrush and then find the same kind with the same either soft or medium head and it is never exactly the same and you have to get used to it again and then whole cycle repeats itself?

Well, no more. I have an automatic toothbrush and all I do now is put its head in this neat sanitizer and it kills all the bacteria and I can go on for another 20-30 days without having to worry about repeating this process. The product has UV bulb, which is what actually kills the bacteria. There is an extra brush head holder for different models of brush heads (Oral-B-FlexiSoft and FlossAction and most Sonicare models). I didn't have troubles putting the holder into the Sanitizer. The cleaning takes approximately 10 minutes and when complete it shuts itself off. It was prebuilt with a drip tray to get rid of excess water. This is a great gift for anyone in your family. Folks, it doesn't get any easier or more practical than this.","Folks, it doesn't get any easier than this",1197936000,,
1667,5,True,"03 1, 2016",A3OYM142VD8I7K,B000URXP6E,{'Size:': ' 170'},Tamikajam,Awesome!!,Five Stars,1456790400,,
827,5,True,"06 4, 2013",A3HHQ7UIJJAOAV,B0009RF9DW,{'Size:': ' 285'},redlin51,"We both love the shower gel.  It smells so good, and matches the lotion that is sold, too.  We love using it.","shower gel used by grandmom and grand-daughter, too.",1370304000,,
812,5,True,"08 4, 2013",A7M85H7UTJEKI,B0009RF9DW,{'Size:': ' 8'},TMB,"This stuff smells heavenly and I am so happy to find Amazon has it!  I have been importing it at a much higher price and love the convenience of ordering it now via Amazon, not to mention the price break.  I use it as bubble bath daily and love it!",Hard to find in CA!,1375574400,,
5141,5,True,"05 6, 2011",A3SFRT223XXWF7,B004CALFE4,,C. C. Christian,"If you ever want to feel pampered by a shampoo this one is the one.  It smells like a wonderful perfume and cleans your hair until it shines plus adding a fullness that most other shampoo's don't give you.  It is expensive, but worth it!",Bvlgari Shampoo,1304640000,3,
1364,2,True,"03 27, 2018",A2TU781PWGS09X,B000URXP6E,{'Size:': ' one size'},Amazon Customer,Doesnt smell,Two Stars,1522108800,,
1076,5,True,"01 4, 2015",A1VRZOJ7MNAJME,B000FI4S1E,,Dee Stapes,"I love the smell of this particular product and the way it feels on my lips.  I wish it wasn't so expensive, because I would buy more!,,",Great smell and texture.,1420329600,,
4183,5,False,"09 6, 2017",A10M2MLE2R0L6K,B001LNODUS,{'Color:': ' Bath Salts'},Booklover,"I am a bath person.  I always have been.  I love floral bath salts (not the kind that get you in trouble), and this fits the bill perfectly.  The lavender scent is light and refreshing, surrounding you with a pleasing aroma.  The salts dissolve completely, not leaving gritty residue behind.",Wonderful lavender scent,1504656000,,
2858,5,True,"09 28, 2014",AZRD4IZU6TBFV,B0012Y0ZG2,{'Size:': ' 200'},Norma Gandy,Like this product very much..it smells great.,Five Stars,1411862400,,
1113,5,True,"08 9, 2014",A1JQIYKCPYFKG2,B000FI4S1E,,S. Curry,My  favorite and hard to find.,My favorite and hard to find,1407542400,,
2628,5,True,"01 4, 2016",A1X60YTH1F0Y9A,B0012Y0ZG2,{'Size:': ' 11 fl. oz.'},G &amp; L,"Finding a ""natural"" shampoo that isn't disappointing is a challenge. They usually fail to lather and leave hair feeling dry or dull. This shampoo lathers just enough and as someone with straight, somewhat thin hair, I've been pleased with the way this shampoo really does smooth the hair but without weighing it down.",They usually fail to lather and leave hair feeling dry or dull. This shampoo lathers just enough and as someone ...,1451865600,,
4117,5,True,"07 19, 2015",A2EM4MVIU5Z0KD,B0013NB7DW,{'Size:': ' 3 Ounce'},jennifer johnson,good,Five Stars,1437264000,,
4877,5,False,"09 1, 2017",A2NN6H2RZENG24,B00W259T7G,"{'Size:': ' 250 Gram', 'Color:': ' Olive Oil'}",Robert C Ross,"Great aromas, great cleaning power, and my Parisian companion says it is a classic French soap.

A bit of Paris in NYC!

Robert C. Ross
September 2017",Excellent soap,1504224000,,
5074,5,False,"11 8, 2017",AOTMP0OKJOUWI,B01E7UKR38,{'Color:': ' Fairy Tailor'},Emily J. Morris,"Essie has always been a trusty polish for me, and my little girl loves this truly sweet and girly pink. It's just... pretty. Fairy Tailor is the cutest name for it. Best of all, it truly does have a quality look similar to gel polish. Very well done, this formula.","Great formula, my daughter loves the color",1510099200,,
636,5,True,"08 18, 2015",A3J539P6RXOP9M,B0009RF9DW,{'Size:': ' 187'},mattie simpson,love love love,Five Stars,1439856000,,
2205,3,False,"09 5, 2017",ARARUVZ8RUF5T,B0010ZBORW,{'Color:': ' Shower Cap'},Kim L,"This is a very standard shower cap. It does the job, but it no different from the ones I have purchased over the years from various drugstores. If you are looking for a shower cap, this one is as good as any.",Standard Shower Cap,1504569600,,
4385,5,True,"07 6, 2016",A1IYXUF0KPKOS1,B001OHV1H4,{'Size:': ' 3'},susanp,Would not use any other conditioner.  I use it at least every 2 weeks to keep my white hair shining and healthy!,Best product for dry or aging hair.,1467763200,,
766,5,False,"02 15, 2014",A1S44RIBM0ZD9U,B0009RF9DW,{'Size:': ' 13.5 Fl.Oz.'},MAMCDOWE,"I purchased this lotion in December 2013 while Christmas shopping.  I fell in love with it right away.  This is the nicest scented body lotion I've found in many years.  I absolutely adore it.  I let a female friend of mine try it but told her up front not to ask for it because it's one item I would not be giving away.  I am trying to use it sparingly so as not to use it up too quickly.  Sadly, I returned to the store that I purchased it from but they did not have anymore.  Each time I visit that store, I always check to see if more of this wonderful lotion has come in, but so far, it hasn't.  The price in the store was much less than what it is being sold for on Amazon.com.  I will continue to check the store to see if more comes in, but will keep in mind that I can order it on Amazon, although it will cost more.  I would love to make this a regular part of my beauty regime.",Hammam El Hana Argan Therapy Egyptian White Musk Lotion,1392422400,3,
4557,5,True,"03 6, 2015",A3TIK2TSPADAH0,B001OHV1H4,{'Size:': ' 25.4 Fluid Ounce'},J. C.,Love this stuff!!#,Five Stars,1425600000,,
2393,5,True,"01 20, 2017",A27VWQXCDU4U9D,B0012Y0ZG2,{'Size:': ' 364'},Linda sommer,Love it,Five Stars,1484870400,,
1456,5,True,"02 14, 2017",A3GM8H7MO9I4H7,B000URXP6E,{'Size:': ' 120'},edazzle,Excellent product,Five Stars,1487030400,,
5108,5,True,"04 30, 2018",AE9VRSOM1TYLE,B0009RF9DW,{'Size:': ' 10'},alan merritt,loved this scent unfortunately can't get it anymore.,Five Stars,1525046400,,
4426,5,True,"03 22, 2016",AL54O8LSKUIQ8,B001OHV1H4,{'Size:': ' 1.69oz'},Kelly Moore,Great product!!,Five Stars,1458604800,,
