,overall,verified,reviewTime,reviewerID,asin,style,reviewerName,reviewText,summary,unixReviewTime,vote,image
4221,5,True,"04 22, 2018",A1L0QECT7J93ZP,B001OHV1H4,{'Size:': ' Shampoo'},Elena,"Got this product for me and  my daughter. I can say 100% - it works superb on both, long curly and short straight hair.",For any type of hair,1524355200,4,['https://images-na.ssl-images-amazon.com/images/I/71HmQNqvSrL._SY88.jpg']
1616,5,True,"04 30, 2016",A2YXTUAVV51KUH,B000URXP6E,{'Size:': ' 23'},Diana Lozier,"Purchased this product after researching products to help my son with his three year old daughters naturally curly blonde hair. The baby shampoos he had used were drying her hair out, and most of the detanglers weighted down her curls too much. Started using this product along with the Dark and Lovely Beautiful Beginnings Deep Conditioner and her hair is more manageable, not dried out, and has the natural bouncy curls that are adorable.",Started using this product along with the Dark and Lovely Beautiful Beginnings Deep Conditioner and her hair is more manageable,1461974400,,
602,5,True,"02 20, 2016",A21931Z4J17AJ2,B0009RF9DW,{'Size:': ' 178'},Sandra,Nice fruity fragrance!,Five Stars,1455926400,,
1556,5,True,"07 26, 2016",A3Q6RS3X7VRVW3,B000URXP6E,{'Size:': ' 255'},Nick Nasc,Been a fave for decades,Five Stars,1469491200,,
4508,5,True,"08 24, 2015",A3IRJA2MBOJ411,B001OHV1H4,{'Size:': ' 13 Fl. Oz'},Anne F. Batty,Every year we vacation on a lake and the kids love to wash their hair in the lake.  This shampoo and conditioner is perfect!!,Perfect!!,1440374400,,
870,5,True,"03 4, 2012",A2Z54QPJOS4TQA,B0009RF9DW,{'Size:': ' 10.2 oz'},Clarkston,I use this for shaving. Constantly get questioned on what I am wearing.  Very light pleasant scent. Bought with the lotion.,Love it,1330819200,2,
4525,5,True,"06 30, 2015",A193RG4GIJ5OLM,B001OHV1H4,{'Size:': ' 6'},Kindle Customer,Love it. Makes my hair just lovely and curly.,Five Stars,1435622400,,
898,5,True,"09 13, 2017",A1D3G0HL756T8B,B000FI4S1E,,Vette,Lovin' them.,Will get more!,1505260800,,
979,5,True,"03 13, 2016",ASLE3QYFD5C70,B000FI4S1E,,kathy leone,Love this!,Five Stars,1457827200,,
4282,5,False,"04 17, 2017",A3JMIBCH90HGWG,B001OHV1H4,{'Size:': ' 79'},Amazon Customer,"This and the matching conditioner saved my scalp. My hair was falling out due to a very dry scalp. Nothing else I tried would cure my issue. My head literally hurt. After one use, my scalp had real relief. My hair looks beautiful after just two washes. I'm definitely going to buy this again. The smell is not great, but you'll look past it to save your scalp. It is one of the only products that is 100% truly organic. No added chemicals. Very gentle and effective. I highly recommend this product.",My hair looks beautiful after just two washes,1492387200,,
1937,5,False,"09 20, 2014",A37DCOJBXHTODF,B000URXP6E,{'Size:': ' 214'},LUVSTAWKIN,Love it!,Five Stars,1411171200,,
4036,5,True,"05 15, 2013",A125PSVY71Q7KZ,B0012Y0ZG2,{'Size:': ' 329'},BlueAngel,It's great! Packaged right no dents on the box (container) it came with. Love the product been using it for years... Will order again from this store.,arrived on time,1368576000,,
3202,1,False,"09 2, 2017",A2SH7OWE8QJYNC,B0010ZBORW,{'Color:': ' Moisturizing Gloves'},Delamaine,"I have often heard about this type of product and I always assumed they would be lined with plastic of some kind, something non-absorbent, because otherwise, your hand cream would soak into the fabric, right?  Well, they are NOT lined with plastic, and the hand cream DID soak into them.  I put my regular application of hand cream on, and worked it in, and then, prepping for sleep, I put a big glob on my hands and rubbed it all around, sort of like you do on the face with a mask or hair with deep conditioner.  But the gloves are snug; some of the cream actually was pushed down to my wrist by the action of struggling into the gloves, and the rest of it soaked into the glove fabric once I had the gloves on.  I took them off a few minutes later because they were so tight on my hands (I wear size 7 gloves so my hands are not that outrageously big.)  As a process I don't recommend this, but if you are willing to deal with the drawbacks, you might like these.  But for me, I'll just keep moisturizing my hands before bed as usual.",Not recommended,1504310400,,
2607,5,False,"02 8, 2016",A14Y0FPHPBKBAF,B0012Y0ZG2,{'Size:': ' 103'},Darcy Boos,"I love this body wash! It's smells like something delicious, but tastes a little funny. It's also great for pulling pranks on your friends because the body wash looks just like blood!!! Highly recommend this product.",I love this body wash,1454889600,,
2113,4,True,"06 17, 2013",A132O42MLTHYSX,B000URXP6E,{'Size:': ' 29'},Janet Martin,"I would give it 5 stars but it is way over priced! My hair is looking better and seems to be healthier but I am using the Reflection Chroma Thermique also so who knows which one is working or if it is the combination..I won't pay that price again, if it were cheaper I would keep using it but I am not going to keep using it at that price..Now that my hair is in better shape I think it will be okay, I had damaged it using bleach..",My hair seems to be healthier,1371427200,,
773,5,False,"01 5, 2014",A36LNAKD2FOHVX,B0009RF9DW,{'Size:': ' 181'},Heather Marie Levan,I recently had this amazing citrus salad from Whole Foods and this body wash is every bit as yummy!  I don't recommend eating it of course but I highly recommend it in the morning to wake the senses.  Refreshing!,Citrus Salad,1388880000,,
45,3,True,"03 1, 2018",A1CEDYAX0NG4BU,B00006L9LC,{'Size:': ' Small'},DD,Does not lather well and have not noticed a difference in my hair,Three Stars,1519862400,8,
875,5,False,"01 7, 2009",AIIR8E34EDKCQ,B0009RF9DW,{'Size:': ' 65'},Kasia S.,"I love this brand because the ingredients are all good enough to eat, its Paraben free and best of all, no animal testing. I first found it online by doing a search for things with pumpkin in it, and now I'm on my 4th bottle of this and I also recommend the body lotion and face creams, I am slowly becoming totally enamored with this brand and always look forward to trying more things.

This wash beats soap anytime in the shower; the orange gelee collapses on itself when poured and feels cool and refreshing especially in the morning. I love the scent, its very delicate, smell like soft fruit scented air, nothing aggressive and doesn't feel too organic and strange but fancy enough. There is ginko biloba and cucumber water, green tea, chamomile, orange and of course carrots, silky aloe, cleansing Dead Sea water and even spirulina extract, which I have drank before but never used in products. It feels very light and my skin always feels clean but light, never dry and uncomfortable. The bottle is also large and lasts a while, which is nice.

As I get older it becomes more important to me to use as little chemicals as possible, of course in today&iexcl;s world we are bombarded with them and its hard since they appear in everything but still, ever little thing counts. Parabens for example are used as preservatives and are generally considered safe because of low levels of toxicity, but lately I keep reading how traces are found in cancer lumps especially in women and simply knowing that a cosmetic doesn't have it makes me happy. And I love my cosmetics almost as much as books, the bathroom is always stacked : )

- Kasia S.",Eat your greens and wash with them too,1231286400,4,
1831,5,True,"05 11, 2015",A3V0ZDC7WJX4G6,B000URXP6E,{'Size:': ' 3.3 oz'},TwoCoconuts,Lovely powder bomb fragrance.  I adore its softness.  Perfect for day or office wear.  I spray with a heavy hand for use at night.  Not much projection but warms to the body nicely.,Gorgeous Scent,1431302400,6,
479,5,True,"12 19, 2012",A2KNKDQ38Q31SJ,B00006L9LC,{'Size:': ' 200ml/6.7oz'},TennesseeGrl,"I stayed at the Ritz-Carlton in Mexico and was really sad when the shampoos I used there ran out. They make your entire hotel room smell great when you use them.

This one has a similar impact. I use it as body wash too, but if you do it I recommend using a loofa to increase the longevity of the bottle. I've been using mine for four months and it only just now ran out. I have used it conservatively, maybe two times or three a week. I use the perfume too, but even with the perfume, my skin and hair still smells like the product for a few hours into the day. I have gotten a few compliments from strangers that I smell nice and clean with just the shampoo alone.",Same as at the Ritz-Carlton in Cancun,1355875200,,
92,4,True,"03 9, 2017",AIQ0ABOHK58F6,B00006L9LC,{'Size:': ' 28'},Caridad J.,Very happy with my first time using it my hair was manageable,Four Stars,1489017600,,
3934,5,True,"01 28, 2014",A2QLQVPUZG2JXU,B0012Y0ZG2,{'Size:': ' 184'},Kyuyeon J.,"Actually, at first I intended to order white musk 'lotion', not the body wash.
So I ordered the wrong item without reading the description carefully.
The funny thing is I USE THIS EVERYDAY.
I smelled both scents of the lotion and body wash, and I prefer this one.",I love it!,1390867200,,
67,5,True,"06 23, 2017",A2GBIFL43U1LKJ,B00006L9LC,{'Size:': ' 60'},K.Sofia,Excellent product.,Five Stars,1498176000,,
2210,4,False,"09 3, 2017",AOEUN9718KVRD,B0010ZBORW,{'Color:': ' Foot File'},Bigslacker,"This foot file is good as a finishing, smoothing touch after heavy duty foot scrubber. Just by itself it won't take care of calluses.",Gentle.,1504396800,,
1433,5,True,"04 15, 2017",A8N02S3VNT60S,B000URXP6E,{'Size:': ' 1 ounce'},michael w,great buy,Five Stars,1492214400,,
1466,5,True,"01 31, 2017",ATEX4XVEQYN7B,B000URXP6E,{'Size:': ' 15'},BERNARD POMORSKI,gives a nice body to thin hair.,Five Stars,1485820800,,
3717,5,True,"06 27, 2015",A32RAW9ILQYP9S,B0012Y0ZG2,{'Size:': ' 200'},sonnja williams,Will buy again,Worth the price,1435363200,,
3843,5,True,"10 3, 2014",A3TXZIWV9XZLMR,B0012Y0ZG2,{'Size:': ' 32'},Nelya,I love this Shampoo and told my friends about it.,Five Stars,1412294400,,
4207,5,False,"05 7, 2018",A2G90R2ZU6KU5D,B001OHV1H4,{'Size:': ' Shampoo'},Mike,"Got this shampoo as a solution for my wife's dandruff problem. It worked! She got rid of any dandruff signs after 3-4 uses. As long as she is happy, I am happy too!","Outstanding, no complains",1525651200,,
2632,5,True,"12 26, 2015",AUQ0Y1LUWQAN2,B0012Y0ZG2,{'Size:': ' 1 Pack'},R,Been using this brand for years. My scalp and hair love it whether I'm living in Calofornia or Hawaii. Good quality hair products!,Great product!,1451088000,,
1551,5,True,"08 5, 2016",A2I02X97TQCOHX,B000URXP6E,{'Size:': ' 48'},Sam,"Man, I wish Axe never got rid of this scent. It's really awesome. It's perfect for those Friday and Saturday nights that you're going out. A perfect blend of warm woods and leather, awesome fragrance.",Party Like a Rockstar!,1470355200,,
1290,5,False,"04 10, 2013",A2RX62V4E2BF5Z,B000NKJIXM,,Celeste,"The Crest Pro-Health line has several different flavors of mint. Fresh mint, smooth mint, clean mint and invigorating mint. How much mint do you actually need? It's refreshing to have a non-mint option. I like the wintergreen flavor. It's refreshing and a nice change from the usual mint.",NOT MINT!! ;),1365552000,,
1769,5,True,"08 20, 2015",A1LA3IVNDE22NW,B000URXP6E,{'Size:': ' 6.7 oz'},Tuffy,"This is my favorite scent in the whole world.  Its very clean and smells like a warm summer day.  Unfortunately, it's been discontinued and very difficult to find.  I wish this one would come back, I love using it at the end of winter when I'm pining for the smells of summer.",The Best Summery Scent Ever,1440028800,,
3292,5,False,"02 21, 2018",A3VC5W5GW7QAQK,B0012Y0ZG2,{'Size:': ' 8.5oz'},Anton Kiptach ,"Awesome product, no doubt ! Use it in the morning before run and my skin doesnt irritate, it already gives it 10 out of 10 ! The smell is great, not chemical which makes more sense to be an organic product but does produce a lot of foam ! Love it !","Awesome product, no doubt",1519171200,2,['https://images-na.ssl-images-amazon.com/images/I/71m6OfFVQjL._SY88.jpg']
317,5,True,"08 7, 2015",A3IZX2IWVGM9QH,B00006L9LC,{'Size:': ' 58'},Brenda,"By far I think this is one of the best mousse there is and love the light smell , it not loud like most mousse , I will buy agin.",By far I think this is one of the best mousse there is and love the light smell,1438905600,,
2798,5,True,"01 28, 2015",A2LFGBMPZPSAMV,B0012Y0ZG2,{'Size:': ' 123'},Katie Miller,"Oh my god... I love Britney spears for one... And this collection !!! I can spritz some of the perfume on, or soak in the tub with the bubble bath, and come out smelling like a vanilla fairy goddess. Such an amazing mix of scents in one spray!!!",My favorite perfume.. the set is even better!!!,1422403200,,
4028,5,True,"06 6, 2013",A1TB2OE42GDXLB,B0012Y0ZG2,{'Size:': ' 283'},duwal,Thank you for selling this.  The company doesn't make it any more or slowed down how much product it produces.  So it's wonderful to see that someone on Amazon sells it...thanks.,I love this scent.,1370476800,,
4558,5,True,"03 3, 2015",A39KHX3058560R,B001OHV1H4,{'Size:': ' 26'},D. Lewis,"I have always liked Prell conditioner and so does my wife. Great product, arrived safe and sound from ""Naturaly"" no problems. Would definitely buy from this vendor again.","Prell conditioner, family favorite.",1425340800,,
4959,5,True,"10 8, 2014",A1MHFSMKSOED47,B00W259T7G,"{'Size:': ' 250 Gram', 'Color:': ' Lemongrass'}",Yasmin,Expensive but lovely!,Five Stars,1412726400,,
4740,3,True,"09 8, 2007",A3SMR4HRFJARSC,B000FOI48G,,ChristineMM,"When I was a child our family bought the first WaterPik that came onto the market. The whole family used it for many years. The area where the water came out was small and the spray could be directed easily. It did not make a mess. It was fantastic for cleaning my teeth, which had braces.

Now that my son has some orthodontia, the dentist suggested using a WaterPik.

This thing is unbelievable. The spray comes out so fast and the spray is so wide, that it makes a huge mess. Even I, a coordinated adult, have a hard time using this without spraying down the bathroom walls, mirror, and countertop. This is a mess. I am worried the wallpaper will be ruined and will begin peeling off.

Tip: Put the device in the mouth, then turn it on. Try to use it with your mouth closed or nearly closed and shut it off before you remove it from your mouth.

After reading other customer reviews, to prevent possible leakage, we take the unit apart and dump out the water after each usage.

Do your research regarding other models available as well as this one. The customer reviews here on Amazon are eye-opening.

I wish they made the WaterPik like the original ones that lasted for many years and were easier to manage.

Update: One child has been using this for 16 months and it is still functional.

Note on my star rating: For effectiveness for the job I'd rate it 5 = I Love It but for the mess I rate it a 1 = I Hate It which averages out to 3 star rating = It's okay.",What a mess! Not the same as the original!,1189209600,30,
3281,2,True,"03 19, 2018",A1BAZK7LSPBPEJ,B0012Y0ZG2,{'Size:': ' Small'},Ryan Johnson,"I agree with several of the other reviewers. Feels as though Im just rubbing banana scented water through my hair and after I shower, my hair feels greesy (like when I don't use any shampoo) so I wonder if there is something fishy going on here. Read the other reviews and you'll noticed most of them have nothing to do with shampoo. DO NOT trust.",I agree with several of the other reviewers. Feels ...,1521417600,9,
2918,5,True,"05 8, 2014",A37PANLDA6ENJK,B0012Y0ZG2,{'Size:': ' 22'},Jo,I absolutely love this scent ever since the first time I tried it.  I hope Thymes continues to make it.,Love it!,1399507200,,
997,5,True,"11 30, 2015",A1OMMCNMFY7TYH,B000FI4S1E,,Amazon Customer,"Smells awesome, great price!",Five Stars,1448841600,,
1360,1,True,"04 2, 2018",A1ZM06J2A5XGHY,B000URXP6E,{'Size:': ' Small'},Amazon Customer,Skin did not improve. Felt like using scented water.,Dont buy,1522627200,,
4218,5,True,"04 28, 2018",ADW00ZRLWD3KG,B001OHV1H4,{'Size:': ' Shampoo'},Walaa,I received the shampoo because I was suffering from dandruff and I was like ok lets try it and I couldn't believe the result from only just one wash. it cleared out the dandruff without drying my hair out. My hair felt smooth and Fresh after just the first wash. I tried aveda spray before but it was useless and waste of money,... because I was suffering from dandruff and I was like ok lets try it and I couldn't believe the ...,1524873600,,
3424,5,True,"11 5, 2016",A25NX4BU2GD908,B0012Y0ZG2,{'Size:': ' 11 fl. oz.'},anne lacy,Very nice fragrance.,Five Stars,1478304000,,
4002,5,True,"08 18, 2013",ASUIA1YIKZUOO,B0012Y0ZG2,{'Size:': ' 3'},Susan Fisher,I have used this before and had missed it terribly. It is a fabulous product that I recommend for anyone with dry course hair.,great product,1376784000,,
961,5,True,"05 28, 2016",A2BTEB0X9BLH2T,B000FI4S1E,,Dave B.,"Hi, I don't believe they are still selling this Azur brand. Sorry for the late review, but this was a great gift for my wife and she loved the fragrance. We look forward to buying something similar.",Great Fragrance!,1464393600,,
759,5,True,"03 18, 2014",A3B9T1GXSEVIWM,B0009RF9DW,{'Size:': ' 113'},Miss D,"Love the way Old Spice High Endurance Body Wash, Pure Sport smells. Gets you clean, classic product that is very effective",Smells great,1395100800,,
2004,5,True,"04 2, 2014",AJILF715MP2SE,B000URXP6E,{'Size:': ' 157'},Ashley,"So yes the little bottle is $20.00 however if you're looking for relief from baby being at the breast, this little bottle is like gold for them. It goes such a long way. You don't need much. It's not greasy feeling like some lanolin can get. We have actually used in for our 8 month old through teething & rash. We'd throw some on at bed & by morning good as new! I highly highly recommend this to all new moms!",Great product! Would recommend to all!,1396396800,,
5105,3,True,"05 8, 2018",A1AN9A2FNOYHTX,B00006L9LC,{'Size:': ' Small'},Amazon Customer,"I bought this in hopes that it would help me get rid of this dandruff that began over winter that for some reason I am unable to get rid of. However it didn't do much, maybe my dandruff is a little bit better. It is a thick shampoo and I do like that it bubble good and smells decent. My hair just doesn't feel clean afterwards no matter how much I scrub.",maybe my dandruff is a little bit better. It is a thick shampoo and I do ...,1525737600,,
3705,5,True,"07 20, 2015",A2PPWA67FGO7BF,B0012Y0ZG2,{'Size:': ' 69'},Harriet Fraad,Fine,fine,1437350400,,
3396,5,True,"01 1, 2017",A250XH0NBH6AHN,B0012Y0ZG2,{'Size:': ' 125'},deborah c. mcclellan,This product is very gentle on my skin,Five Stars,1483228800,,
1763,5,True,"08 25, 2015",A3OPJT8CDLLZON,B000URXP6E,{'Size:': ' 268'},M. Bernard,Best cream ever,Five Stars,1440460800,,
5152,5,True,"02 4, 2014",A31XUJMEDBUGKR,B007R6UXNY,,Terry V.,"Beautiful Beginnings have been the answer to my prayers when it comes to my daughter's very thick and curly hair. The shampoo, Detangler and Conditioner work like a charm together. Her hair was breaking too much prior to me using these, not, I only get a few strands when am all done washing and combing her hair. I can't seem to find them in the local Sally Beauty Supply nor grocery stores. Highly recommend!",Works great!,1391472000,,
2215,5,False,"09 2, 2017",AKJHHD5VEH7VG,B0010ZBORW,{'Color:': ' Volcanic Pumice Stone'},Mindee Urbis,"This is a great product. I used it after a shower and it did a remarkable job at removing rough spots from my feet.

Thus fits comfortably in the palm and covers a greater surface area than other types of foot smoother.  It glides over curves and contours  without missing a spit. This performs much better Han cheese greater types of tools as well as the eggs.

Great product at a reasonable price.",Does a better job than the cheese grater type,1504310400,,
2481,5,True,"07 25, 2016",AHQ9P60N6NOAH,B0012Y0ZG2,{'Size:': ' 281'},Beth,Smells very nice.,Five Stars,1469404800,,
4588,5,True,"10 9, 2014",A3T1HGP5MN7OB6,B001OHV1H4,{'Size:': ' B-013'},lefeverb,Great Product. TOBS always has very pleasant and masculine scents!!,Very Pleased,1412812800,,
3670,5,True,"08 30, 2015",A1WL02Q81VWPX6,B0012Y0ZG2,{'Size:': ' 515'},Vickie W.,This has been my favorite forever!,Five Stars,1440892800,,
507,5,False,"02 21, 2018",A3VC5W5GW7QAQK,B0009RF9DW,{'Size:': ' 8.5oz'},Anton Kiptach ,"Awesome product, no doubt ! Use it in the morning before run and my skin doesnt irritate, it already gives it 10 out of 10 ! The smell is great, not chemical which makes more sense to be an organic product but does produce a lot of foam ! Love it !","Awesome product, no doubt",1519171200,2,['https://images-na.ssl-images-amazon.com/images/I/71m6OfFVQjL._SY88.jpg']
334,4,True,"06 13, 2015",A1E9D6RGEDFT2O,B00006L9LC,{'Size:': ' 7'},Daria Terletskaya,"I think this shampoo can be even five stars, hair feels soft and fresh. But I think it doesn't give that feeling of clean hair near my roots. It might be just not the right type for me. But in general I would definitely recommend these products.",But in general I would definitely recommend these products,1434153600,,
1294,4,False,"04 7, 2013",A2UOHALGF2X77Q,B000NKJIXM,,DLH,"Crest Crest Pro Health Cool Wintergreen Mouth Wash is a mild tasting , alcohol free, mouth wash. I wouldn't describe the taste as great, but I like it much better than harsh mouthwashes that leave your mouth burning. Like another popular brand, Crest Pro Health Mouth Wash kills 99% of common germs that can cause plaque, gingivitis and bad breath. I like to use it between brushings for a quick freshen up. I recommend it.","Good, non-burning mouth rinse.",1365292800,,
1767,5,True,"08 21, 2015",A1A7LP8GUKEPZM,B000URXP6E,{'Size:': ' 248'},Graciela Vigil,"Great Product, Great Price!",Five Stars,1440115200,,
2677,5,True,"09 5, 2015",A1RM3LETB09B5E,B0012Y0ZG2,{'Size:': ' 186'},Bun,Smells great good packaging easy to squeeze out,Awesome!,1441411200,,
682,5,True,"02 23, 2015",A3E1JS2EB8ZH94,B0009RF9DW,{'Size:': ' 10'},trace,I really like this wash and was feeling lazy so I decided to buy it on amazon. Just be advised its about 3-4 times more expensive on amazon than in most stores.,I really like this wash and was feeling lazy so I decided ...,1424649600,,
189,5,True,"06 27, 2016",A21VGLAQKA6UXO,B00006L9LC,{'Size:': ' 15'},Little Britches,"This is a great help for fine hair, I've used it for three years and it really makes a difference !",Really does the job !,1466985600,,
376,4,True,"12 14, 2014",A2S97Z2I1TFOS,B00006L9LC,{'Size:': ' 25.4 Fluid Ounce'},Gullu&#039;s mom,"Nice shampoo with conditioner. So far, it has not caused any excessive dryness in my hair. Giving it 4 stars as the conditioner part is nothing fancy. My hair don't feel ""well conditioned"" after its use. If you are looking to save time and provide ""some"" conditioning to your hair, this product is good. However, if you are looking for a ""healthy shine"", you should use conditioner separately.",Its okay.,1418515200,,
4960,5,False,"10 8, 2014",A1MHFSMKSOED47,B00W259T7G,"{'Size:': ' 250 Gram', 'Color:': ' Jasmin'}",Yasmin,Expensive but lovely!,Five Stars,1412726400,,
441,5,True,"11 21, 2013",A3HSZWSBQVFNEV,B00006L9LC,{'Size:': ' 7'},Williams,"I have thick but fine hair, and I had a hugely horrible cut that left me with layers of split ends.  My hairdresser recommended this product and it's absolutely terrific for my hair.  It leaves it looking much better while it grows out.  My hair looks a little courser (nice), and I get great volume. Split ends are managed better.  Great smell too.  I use it with the Matrix conditioner (and I usually don't like conditioners) and it leaves my hair so soft but it doesn't lose its shape.  I was recently traveling and ran out, used a different product to wash my hair, and was miserable until I could get back to this product.",Great Products.,1384992000,,
2619,5,False,"01 24, 2016",AM88FAF0V7U6D,B0012Y0ZG2,{'Size:': ' 483'},Amazon Customer,Awesome product,Five Stars,1453593600,,
3760,5,True,"03 28, 2015",A2JWINJJ8E1IIC,B0012Y0ZG2,{'Size:': ' 5'},michael mcnicholas,I love this shampoo . It leaves what hair l have left nice and clean.lt also smells nice.,Five Stars,1427500800,,
73,5,True,"05 19, 2017",A2JPQVFMKT94M2,B00006L9LC,{'Size:': ' one size'},ad,"This is so handy and unique! Comes in a protective pouch, and with an extra refil. Seems like it will last a long time for those who just like a little dab of a beautiful scent.",Seems like it will last a long time for those who ...,1495152000,,
1904,5,True,"12 8, 2014",A2KA5PR2AKM7ZU,B000URXP6E,{'Size:': ' 127'},susanb1222,The price for an Hermes product is the best,Five Stars,1417996800,,
4756,4,False,"04 9, 2013",A15T9G38F589KM,B00DY59MB6,{'Size:': ' 16.9 Ounce'},knitting ninja,This does the job at least as far as the bad breath goes (as for the other claims I'll have to take their word for it).  The one thing I didn't like about it is the way it makes my mouth feel when I use it.  It's like rinsing with hydrogen peroxide and it makes my mouth feel dry.  I usually rinse or drink some water afterwards to re-moisten my mouth.,Does the job,1365465600,,
5163,4,True,"11 1, 2014",A3TH0R81AWDJ49,B00B9V9ASM,,Eva Sidera,"Nice shampoo, and the smell is magnificent. Lingers on the hair all day, I get compliments all the time. I usually leave it on my hair for 10 minutes, wash it out, leave it to air dry naturally and use a frizz eliminating or heating serum with the flat iron. Wouldn't recommend it for coarse hair, it didn't leave the same results for my brother.","Nice shampoo for mild curly hair, straight",1414800000,,
3447,5,True,"09 15, 2016",A3E9ZV03ZD1ZI,B0012Y0ZG2,{'Size:': ' 122'},Amazon Customer,I love the scent.,Five Stars,1473897600,,
