,overall,verified,reviewTime,reviewerID,asin,style,reviewerName,reviewText,summary,unixReviewTime,vote,image
474775,5,True,"04 10, 2018",A30KY00WJXXIFI,B00KHUM7WW,,Stacy H.,I love these things. I also make my own felted wool balls. I put the smaller wool beads in bead cages from PandaHall Elite  and they look so professional.,"Very nice sizes and colors, fun to work with",1523318400,,
363873,1,True,"07 22, 2017",AYO6TU3G9Y272,B00S4NQYBY,,Peaches60,"Unfortunately this stand didn't work for me. I wanted to support my light box, but it kept collapsing. Sent it back.",Didn't work for my needs,1500681600,,
154823,1,True,"04 6, 2018",A2O74BQ4O386UO,B001O5NFGQ,{'Color:': ' Violet'},Michelle C.,"Be very careful with this product. I did not have any skin contact with the dye while dying a pair of pants, but still had a horrible  allergic reaction to it. My arms, from wrists to elbows, and my face had rashes and swelled. It looked like a sunburn in some areas and lasted for over 2 days.  And now I can't wear my pants anymore for fear of a reaction.  The only time I touched the dyed pants without gloves was after 2 full wash cycles with detergent.  Not sure what happened, but it was awful.",Horrible allergic reaction to this dye.,1522972800,,
483566,2,True,"06 9, 2018",A6H386LTX2BS7,B00UY151G8,,Aidan,"This probably works great with larger, broader designs on smooth surfaces. However, I tried to apply a delicate die cut of vines to a textured fabric (a faux-leather) and it did not work at all. Running it through the die cutter, with parchment over it as the instructions said, resulted in the backing coming off the adhesive. When I finally did get the backing to stay on one (after three attempts, wasting tons of the product...) and adhered it to a test scrap of fabric (with my iron set to medium heat, the design covered in parchment, for thirty seconds, just like the directions say), when I pulled the backing off the adhesive came up with it in some of the thinner, more delicate areas. I tried to reheat those areas to get it back down, but it just wouldn't stick, resulting in a broken image. Very glad I thought to test this first, otherwise my fabric would have been ruined!

I think the problem was the texture of the faux-leather. I could not see anywhere it specified not to use on textured fabric (and in fact the Amazon description says specifically that it's great for porous surfaces). I'm very displeased with this, as I don't do gold/silver leafing very often and can't imagine needing this for anything else. This was a total waste of money.",Not good for textured fabric and/or delicate designs!,1528502400,,
125536,5,True,"04 27, 2016",A8ZWFSX3WE5UP,B001705RTQ,,Larissa C.,What I needed!,Five Stars,1461715200,,
8701,5,True,"07 2, 2017",A247ZUARA05S6L,B0007D63NI,,Amazon Customer,Excellent kit. I love it,Excellent kit,1498953600,,
210907,3,True,"12 17, 2013",A17V9XL4CWTQ6G,B004E3OKOG,,Chandler,"I'm not a huge fan of this once I got it...The image is about the size of a business card, making the photofilm part of it not really usable for trying to draw or paint something inside of it. And the rest of the image is very hard to make out...What's odd is the actual stamp size is far larger, they just made the actual image part take up a very small part of the rubber.

Still, I can find some uses for it and I am a fan of how much detail is involved in the stamp.  I will be able to make use of it in spite of it not being entirely what was expected.  He makes high quality pieces and this is not exception. It doe stamp well.",The actual whole image is about the size of a business card.,1387238400,10,
292337,4,True,"07 5, 2016",A3HTSUFIDPZ9KU,B00CB3BZBW,{'Package Quantity:': ' 1'},keisa,Great small tubes for small jewerly or any crafts projects.,Four Stars,1467676800,,
348521,5,True,"01 9, 2015",A8ANJNZAZQ6IQ,B00MW43YZA,{'Size:': ' 2.0cm~6.0cm'},Guitar Operator,"I got this for a Christmas stocking stuffer.
My girlfriend loves it.
She says it has all the sizes she needs and the handle are comfortable to grip.
She also said she can go faster with these with less pain. lol.",My girlfriend loves these!,1420761600,3,
483454,4,True,"03 12, 2018",A3VKGU76769LXF,B00UV3ZL9G,{'Color:': ' Original Version'},Marge S,I like this glue for working on felt. My only issue is it quickly seems to get thick and hard to squeeze. But it dries clear and holds up well.,I like this glue for working on felt,1520812800,,
334235,5,True,"03 20, 2015",A1VTTGG32E9CTD,B00JOVOM1E,{'Color:': ' Black'},Michelle Faison,Same as review for Forest Green,Five Stars,1426809600,,
387504,5,True,"08 30, 2016",A2WVQVDK409WQA,B014RL6R22,,E. Weaver,Great price for 3 tape measures. Having 3 around the house will hopefully guarantee I will have one in all the locations of my workroom.,Good value,1472515200,,
141430,5,True,"04 12, 2013",A2DWBSZ5AD1W4I,B001CE38NE,,Andrea O&#039;Brien,"I love, love, love this tool. It is long enough to create long strips, and small enough to not be cumbersome while measuring out fabric to cut. Because it is 24"" long, you don't generally have to reposition it to try to finish the same cut line, which is nice. Every sewer/quilter should have one of these as a standard tool.",My Go-To Tool,1365724800,12,
188471,2,True,"09 28, 2015",A3J9AUC9FZSY2W,B002Y6HFBK,{'Style Name:': ' Iridescent'},Judy,Those glitters are not as vividly colorful as they look like in the picture.  They are really pretty light and faded in color.  I'll keep them anyway since they are not that bad.  The price is alot cheaper than the ones in the local stores.,fine glitters,1443398400,,
242312,5,True,"02 22, 2015",A177QDHMICMWGH,B005ZLSB6Y,{'Color:': ' Sage'},Littleman,Wonderful stuff. Easy to work with. Makes beautiful leaves.,Five Stars,1424563200,,
323991,5,True,"07 13, 2015",A3TIQLRHWL5BYZ,B00HYQ2S1W,{'Color:': ' 6mm/Green'},patricia matolyak,Nice,Five Stars,1436745600,,
446877,5,True,"12 21, 2014",A2CDD4F0UONPIF,B005OIWS9O,,Mariann T,Perfect to and to my journaling statch,Five Stars,1419120000,,
448810,5,True,"07 19, 2016",A20WYZ86CEDQVL,B0068RRJ2Q,,Rita Hemken,Love it!,Five Stars,1468886400,,
371388,5,True,"08 23, 2016",AWD3H7XIM1I90,B00V52G6B4,,Kay Moore,the clips work great,Five Stars,1471910400,,
59158,5,True,"11 19, 2015",A28GN1LD029P6A,B000YZARO0,,SwimminNurse,These are my favorite little scissors..... and I have a lot of scissors... perfect for needlepoint....,"Sharp, sturdy, comfy, inexpensive....",1447891200,,
234984,5,True,"10 8, 2013",A3F63PWHBDERHS,B005JZ7ZKE,{'Style Name:': ' Baby for Her'},Amazon Customer,"I got this for a baby shower gift and am very excited to give it to my cousin. Since she isn't exactly crafty, I set it up in an (the Blush pink chevron) album, gave her some extra pages and the remaining cards as well. This way all she has to do is add her pictures, but she has the freedom to change things around and add more if she wants.",Perfect baby shower gift!,1381190400,,
179083,3,True,"12 10, 2016",A1MUDXEFH8M53R,B002C8EZV8,,Sherrill,Bought a surebonder detailed glue gun and nozzle sits to far toward so it drips glue down front edge of stand. Also even with mini glue gun it is not steady,Bought a surebonder detailed glue gun and nozzle sits to ...,1481328000,,
209154,4,True,"11 13, 2014",A15WDJOU6B9FLQ,B004BPXWWI,{'Size:': ' 1 Pack'},Amazon Customer,Fine. Seems a tad pricey for what I got but I needed them....,Four Stars,1415836800,,
365188,1,True,"07 6, 2016",A3HTSUFIDPZ9KU,B00SPXSICQ,"{'Size:': ' 6 mm', 'Color:': ' Silver Plated/#001 Clear Crystal'}",keisa,"I can why the price was so cheap, you pay for what you get",Don't buy,1467763200,,
443714,5,True,"04 27, 2017",A2KKE27CS13NSV,B00512BY34,"{'Size:': ' Size 50 Oval Wash', 'Color:': ' Oval Wash'}",RFuentes,I'm satisfied with this paint brush. considering ordering a larger size brush in the future!,Princeton Neptune oval brush,1493251200,,
79020,5,True,"12 1, 2015",A39QLF9UNRHCIZ,B0016OMUV6,,RLG,Love the texture on this paper.  This is a repeat order and I'll prob. order more once I run out again.,Love the texture on this paper,1448928000,,
387048,5,True,"05 4, 2017",A29M1EF8N0T3W2,B014JU3BGG,,Lauren Murphy,They work well and for this price they are a steal!,Five Stars,1493856000,,
193663,5,True,"01 18, 2018",A1UORPYTJFN9KE,B003D7ATJO,{'Color:': ' Charcoal Grey'},Amazon Customer,my wife likes the product,Five Stars,1516233600,,
92763,5,True,"03 11, 2017",A1DLQHMPMXU7WF,B000XAUKZM,"{'Size:': ' 1-Pack', 'Color:': ' Naturals'}",Michelle Wiederman,"Awesome quality clay, easy to work with!",Fantastic quality!,1489190400,,
3360,5,True,"07 28, 2017",AVC9Y85D1NPCJ,B0001DSIVY,{'Size:': ' 3 PACK'},Ginny,Since I sew a lot rippers are always handy. The bad thing is they tend to get misplaced! Thus I need a lot of them!,The bad thing is they tend to get misplaced,1501200000,,
303229,4,True,"04 24, 2015",AH70A62F0Z6K7,B00DV8ZWB0,{'Color:': ' Ornaments'},Charlotte Henley Babb,"The picture frame elements seem to work best in this mold, but that may be due to my inexperience with hot glue guns and molding. The detail is very good, but I have problems getting the mod-podge glue to stay inside the lines, so to speak, so as not to have to clean up the resulting artifacts so much. Still, it does what it says it does and I'll be using them with my steampunk accessories.","Good Detail,but Fiddly",1429833600,,
442533,5,True,"11 19, 2016",A3N40UBOD46PQD,B004UDNWI0,,Wilma Lozada,Love it,Five Stars,1479513600,,
346458,2,True,"02 9, 2015",A2GD3YXV7A2KVG,B00MFS24Y0,{'Color:': ' L-Style-Bobbin-Gauge'},Montika Allen,This particular one did not work on my Babylock longarm quilting machine . . .very disappointed . . .maybe they have one which will work on my machine. Will worry about this another time!,very disappointed..,1423440000,,
442139,5,True,"05 10, 2016",A18MPPFR86IO6W,B004PE0VHO,,Jeannie,love these,Five Stars,1462838400,,
211858,2,True,"04 3, 2015",A2CAWUXVE2FPZE,B004HSATLQ,{'Size:': ' Size-US-J-(6.0mm)'},Christine,"I bought this hook because I was enamored with it's detail - the sleek wood, the carved handle, the length. In this regard, it did not disappoint - it is truly a beautiful hook at a reasonable price.
Using it was another story. It felt good in the hand, however it is almost impossible to hook yarn onto. Even after several separate attempts, the hook passes right past the yarn without hooking it and takes a far more tedious hand to achieve said goal.
Another qualm I have with the hook is that it tends to snag at the yarn, fraying it during the crochetting process.
In the end, I went back to my aluminum hook and never looked back.",Disappointed.,1428019200,,
260079,5,True,"07 20, 2015",A36QJMQZNT0TZD,B007WDRW22,{'Style Name:': ' Fossil Leaves'},MommaVirgo,"Very nice!  Great detail on the leaves, good quality, and they are perfectly sized.  I received my shipment very quickly and I am overall 100% satisfied","Great detail on the leaves, good quality, and they are perfectly sized.",1437350400,,
344381,5,True,"12 30, 2017",A2IZJWM533O9FW,B00LUZBTQS,,Sarah Townson,"Its perfect, and exactly what I needed for my artwork. It came in a HUGE box, it made me think I ordered the wrong size at first. However, the sketch board inside was the right size, which Im happy about. It works very well, I recommend trying to keep liquids away from it, if it gets wet the board will swell a little, and not feel the same.","Its perfect, and exactly what I needed for my artwork",1514592000,,
144523,4,True,"12 4, 2017",A2GI6MB9RZL72O,B001DMMTJ4,{'Color:': ' Grey'},Azul,For some reason I don't like it too much. I don't even know why because it does what it is supposed to do.,For some reason I don't like it too much,1512345600,,
453516,5,True,"08 9, 2017",A39L8B4YDQ7ZC,B008N0BCR4,,Louigi,Love this paper!,Great watercolor paper,1502236800,,
370583,5,True,"06 9, 2016",A3D7TVLB5MD000,B00UY14ZLA,,Sandra Pace,I have been using this as a backdrop for picture taking and it's been great!  So glad I found this.,... as a backdrop for picture taking and it's been great! So glad I found this,1465430400,,
292521,5,True,"04 21, 2017",AOAUX416BR517,B00CBGKNQ2,"{'Size:': ' Medium', 'Color:': ' Soft Blue'}",Mechele Parker,"Used this for a sewing case. It is very nice, and has lots of room!","It is very nice, and has lots of room",1492732800,,
250989,5,True,"08 7, 2015",A2VI9Z6RBXOA4F,B00756OEVI,,gradstudent,Great bottles.  Great for glues or something you want to get a small amount  of glue on.  Just as described by seller.,Best applicator,1438905600,,
486961,5,True,"01 20, 2018",A1H0A3NG7MAMRU,B013QBLMTC,,Denise,great die,Five Stars,1516406400,,
125916,5,True,"01 11, 2017",A1HYJR7B0U4SU7,B00172V5VI,{'Size:': ' 1-Pack'},Patricia Andrews,Strong thread which held up to continuous button pulling. Would purchase again.,Nice quality!,1484092800,,
83594,5,True,"03 20, 2017",A1ZULZZC62HMM5,B00178OTN8,"{'Size:': ' 5pk', 'Style Name:': ' Tacky Pack'}",Natalie Capps,I love this glue.  The size is perfect for children or smaller projects.  Great sticking power.,A great glue option!,1489968000,,
279322,5,True,"05 22, 2014",A2Z45Q67ID0GUG,B00AYTRFV4,,Dee Lombard,"Love, Love, Love Spellbinders dies!  These make the most fancy edges, and have taken my card making to the next level!  I am definately going to get the others.",Wonderful product!,1400716800,,
132795,5,True,"06 14, 2015",A1EOUHIUZJSTYG,B0018N0D0K,,Cynthia Martin,I am very happy with my purchase.,Five Stars,1434240000,,
393187,2,True,"07 24, 2017",A1DV24TZGXBNDK,B017IC96S4,,MyAll,"Not happy with this product, item size was not as described. They were too small for my project, I retured item. The company didn't issue a full refund for some unknown reason.",False description information,1500854400,,
350725,5,True,"04 30, 2015",A2AC3ZCSOUP6TI,B00ND5TRI0,{'Size:': ' 4mm'},SWG,"Very small, but very pretty beads. Probably some of the prettiest I have purchased online.",Love these,1430352000,6,
32275,5,True,"03 3, 2018",ALBZTSGWFWLC1,B000P0LNRE,"{'Size:': ' 2 Scissors', 'Color:': ' Gray/Yellow'}",Kris Malfroid,Love these Titanium scissors.,Five Stars,1520035200,,
53526,2,True,"11 25, 2016",A3BM7CNCHP0TS5,B000Y8W71I,,Ganna Portyankina,"I wanted to use it for limo clay, but it seems to be too soft for this kind of tools.","I wanted to use it for limo clay, but ...",1480032000,,
409162,2,True,"09 17, 2017",A492HXZOCVUIJ,B01DU0S7W4,{'Color:': ' Brush Tip'},Jan,"They are vibrant, for sure. The barrels are super light and thin, making them feel kind of weird. At least to me. And then the tips fray easily no matter what kind of paper you use. They are too soft/fragile in my opinion. Otherwise I love their colors.",The barrels are super light and thin,1505606400,,
34552,3,True,"06 14, 2016",A1XRBAW2YY2TS1,B000RB3PZ4,{'Size:': ' 1 - Pack'},Sudhanshu Rath,"I ordered this item on May 23, 2016. They were shipped two days later, and I received them today, 6/14/2016.
The hooks were very flimsy and small, however they were stamped 925 so I do believe that they are genuine sterling silver.

Overall, I feel this is an okay product. Not too good, not too bad.","Not too good, not too bad",1465862400,,
132821,5,True,"02 5, 2015",A2QRH2302UKFTL,B0018N6TJ4,{'Color:': ' White'},Denise R Rodgers,Worked very well. Used on crafts.,Five Stars,1423094400,,
114186,5,True,"12 26, 2014",AVG2YPX19DRYM,B00135DJQ8,,Dinky,As described.,As described.,1419552000,,
320174,5,True,"03 11, 2015",A1OCLIGJLQVPUG,B00GYFTDDU,,Kathy Hankins Shatwell,Get for what I need them for! Haven't used but one.,Five Stars,1426032000,,
153772,5,True,"03 1, 2015",A205Z2JYTF7AK0,B000I6DHAG,,Beachbound,I love this yellow color and love the brand as well!  Great seller too!,Five Stars,1425168000,,
84130,3,True,"01 25, 2015",A35K0699AN1EJ1,B00178QSE6,"{'Size:': ' 4oz', 'Product Packaging:': ' Standard Packaging', 'Style Name:': ' Fabric Adhesive Bottle'}",MARLA,HAD TO MORE THAB ONCE ON THE SAME SEAMS,Three Stars,1422144000,,
350578,5,True,"07 14, 2016",A18Y9MSOF6P6SA,B00NBFSVD4,{'Color:': ' Dark Pink'},marshall,LOVE,Five Stars,1468454400,,
368667,5,True,"05 6, 2016",AKRD56TZ3S4J8,B00UEN5UDK,{'Color:': ' 7'},Kay F.,Lovely,Five Stars,1462492800,,
130463,5,True,"03 16, 2015",A1U5GAGA7HJAKP,B0017RGKCC,,Fran Montgomery,Just what I needed,Five Stars,1426464000,,
126694,4,True,"11 25, 2016",ACM6RS7JMN2D4,B00172XBQA,,Crochet Lover,"Speedy delivery, exactly as advertised.  I ordered five skeins of this yarn for joining blocks on an afghan I was making.  It was a perfect color for my needs.  The only problem was that I found a slub in one of the skeins  not a real problem, but I could not give the product a five-star rating. Otherwise, everything was fine. The appearance of that one little imperfection is probably a very rare occurrence. I am usually very happy with Red Heart yarns.",A small flaw found in one of the five skeins I ordered.,1480032000,,
470448,5,True,"07 10, 2018",A2TR29B4I57NNM,B00I00RASM,,Ali S. W,Perfect blade & housing for my Explore Air 2,perfect for my Explore Air 2,1531180800,,
259453,5,True,"09 23, 2017",A3KPJQR7UZLZBV,B007S0RKOO,,Kevin B.,Nice paint pens,Five Stars,1506124800,,
66462,3,True,"02 16, 2017",A16KPQPPSZPX7M,B00114R7GE,{'Package Quantity:': ' 1'},Trish Fitzpatrick,"The sponges are useful for the demands of watercolor with four different impressions. A bit pricey, though. There are only five little bitty sponges. For  this price, I would expect many more.",Not as many as there should be.,1487203200,,
437073,5,True,"04 16, 2016",A18PNU23FTXIKV,B003ATNM6W,,mariopapi,Pretty and shiney will definitely make my leather bags pop,Nice Studs,1460764800,,
141000,5,True,"04 19, 2014",A3CGR20CB02KCR,B001CE3CGM,{'Color:': ' Original Version'},Savvy Shopper,"I bought this because it was suggested for use with some longer dies and extended platform.
To be truthful, I haven't really cut much that is that long, and when I do, I try to use the shorter one when I can.  It does make using the longer dies easier, so it really becomes a necessity if you like the longer dies.",Extend the idea,1397865600,,
73477,5,True,"12 23, 2014",AIH75SCATCF8C,B0015OFO10,{'Size:': ' Size-US-17-(12.75mm)'},mike&amp;amp;pam,Just what I needed to complete a project!,Perfect!,1419292800,,
13078,5,True,"06 7, 2014",A3AO58MUZZHDTW,B000A7JJF0,"{'Size:': ' 9""X12""'}",Iris,The most perfect sketchbook in the world.  I love this.  The pages are wide and the book itself is large.  Buy this!,Perfect.,1402099200,,
83025,5,True,"09 3, 2015",A38893TZJBZG8R,B00175UAY8,{'Color:': ' Yellow'},TNT,Nice add on,Five Stars,1441238400,,
137153,5,True,"12 11, 2014",A2EWV0VXK8AQ8V,B001B0S2H6,,Ho***sh,"Item as described, great packaging. Highly recommended. AA++",love this organizor,1418256000,,
458927,5,True,"03 1, 2018",A17J4SPF0R1YEI,B00BD92N5M,,Morbious2,"Nice colors. Just what I needed for beading w/beads that have very tiny holes! Very nice company to work with. Let me know when shipped, personally.",Great for seed beading!,1519862400,,
227600,4,True,"01 5, 2016",A1WLC651BQVNHW,B005572NPS,,Louise,"I have only used it once, but had no problems. Received it fine in a padded envelope.",Received it fine in a padded envelope,1451952000,,
311028,5,True,"05 12, 2016",A1LSQATCSINALY,B00EZWY3WU,,K. Sterry,"I bought this for a sewing expo weekend, and it was perfect.  It was small enough to fit in my travel sewing notions bag, the applicator makes a super fine line of glue for applique work, and the cover kept it from spilling or drying out.  Excellent product.",Just What I Needed,1463011200,,
472802,5,True,"12 3, 2015",ABHAXZ43GQKQP,B00J4Z4QXO,,Tracy Ford,GREAT PRODUCT,Five Stars,1449100800,,
58487,5,True,"02 8, 2016",A39F89DXXRFICU,B000YZ7SJM,,Frankie Lee,Perfect!,Five Stars,1454889600,,
352897,3,False,"01 1, 2015",A2HC9549CZAKNN,B00NTSCRQA,,B. McCarthy,"This seemed much more laborious than I envisioned. It seems like it will take a while to make a frame and it will definitely not be easy to make it perfect. For a punch there sure were a lot of instructions and then  you do a little of the frame piece by piece. You only get the one shape with this kit...if you want others you have to buy it. I can see someone who really likes scrapbooking and has the time to do this, but it just seemed difficult, complicated, time consuming and hard to get perfect. It did work as it was supposed to, though.",Can make a frame.... with a LOT of work,1420070400,,
127355,5,True,"10 1, 2015",A1D1M7YZKAHBM5,B00172XBQA,,Buffyisadog,Best yarn out there.,Perfect,1443657600,,
274906,5,True,"11 12, 2015",APVO3CQSVUZ3S,B00ACYE5ZK,,Matty Tee,These guys a great!,"Ships really fast, Thank You!",1447286400,,
273449,1,True,"06 19, 2013",A38DY8EQ58BIJD,B009XD17WA,"{'Size:': ' 10 inch', 'Color:': ' Black Non Metallic'}",H H,"Poly mesh? If I see ""poly mesh"" I am thinking polyester mesh...WRONG.  This is polyurethane mesh!  That is quite a bit of difference. Polyester mesh would be more like a faux burlap. This product is like a PLASTIC mesh.",Poly mesh,1371600000,,
262746,5,True,"12 2, 2015",A3QUHVM83DSDUM,B008CVJK2S,{'Color:': ' Sunrise'},Terresa Powley,"Love this yarn so easy to work with, glad I bought a bunch.",Five Stars,1449014400,29,['https://images-na.ssl-images-amazon.com/images/I/61GTnWa1PbL._SY88.jpg']
286749,4,True,"08 13, 2013",A250OX96NGDKM3,B00BLZ3WCG,{'Color:': ' Style-T'},RichGirl,I purchased this set so that I could start on my collection. These are the smaller sizes so you will be somewhat limited in what you can use them for.,Nice start for a collection,1376352000,,
448054,5,True,"06 7, 2018",A2WVTNUGCSXSPF,B005Z3XYEG,,Brooksie Steinman,Satisfied with product. Just what looking for.,Five Stars,1528329600,,
81525,5,True,"10 21, 2016",A3M5CJ8V7AYCCS,B00172XBQA,,barbara g.,"wonderful color, fun to work with other colors",Five Stars,1477008000,,
21314,5,True,"07 5, 2016",A133QZ11H2FDK8,B000FZ6Z3G,{'Size:': ' 1 Pack'},x,Exactly as described.,Five Stars,1467676800,,
329703,5,True,"05 4, 2017",A2PNFTL0HPJHGP,B00IYAWHMC,,Iris Craig,"Perfect size for the wedding favors I needed to make. About 3inches in diameter and a good inch or so thick.

See?",Perfect size for the wedding favors I needed to make,1493856000,3,['https://images-na.ssl-images-amazon.com/images/I/71g77GohlyL._SY88.jpg']
17095,5,True,"12 11, 2012",A2DDOI95THHL77,B000BKVMOM,{'Package Quantity:': ' 1'},Mariya,"I love this organizer. I love cross stitching, and there is always lots of pieces of floss left. I used to keep them in a plastic bag where they got tangled and impossible to use again. Now all the leftovers are neatly stored in the box. I only wish there were more plastic bobbins so that I could store all my numerous floss in the box, and not only leftovers. In any case, it's a great purchase!",great storage,1355184000,,
272292,4,True,"04 6, 2016",AGOCD81BKWLR5,B009NQ1FQK,{'Size:': ' !!18'},amber,"I'm amazed by how many I received. I know, I know, I know, read the description first right? I did. I can still be surprised and in knitters heaven.  I feel like the smaller ones might break if I slightly bend them though.  The size is on the side of each needle.  Smooth, light, and quite a good quantity. I can't wait to try them!",I'm amazed by how many I received,1459900800,,
479461,3,True,"04 6, 2016",A1NKX2UVP8HSFA,B00OL1SWE0,,Feather Foot,"Folder doesn't close tight, so keeping the die cuts in place while they run through machine is difficult. It is pretty though, if you manage to keep it in place & lined up.",Pretty but...,1459900800,,
305620,5,True,"04 19, 2016",AG5LBYM2H66NW,B00E0OP0WA,,Allen,works good,Five Stars,1461024000,,
71782,5,True,"11 24, 2014",AIO7KN162SRYD,B0013UD43Q,,A. Etheridge,no problems,Five Stars,1416787200,,
167262,5,True,"11 19, 2013",A3LDLV1GWQJLEQ,B0025TTKQE,,E. Talerico,"These needles are great - they have a nice big eye, making them very easy to thread.  They are sturdy, heavy enough to get the job done, but small enough that you won't have to struggle to push them through.  Great for any sort of binding. I use them mostly for coptic bindings.",Great for any sort of binding.,1384819200,,
258631,5,True,"08 18, 2017",A1ITN02Y75HMUN,B007QNVBMK,{'Color:': ' Pastel & Jelly'},Kenny,so organized,Five Stars,1503014400,,
224455,5,True,"05 4, 2015",A5CZTI7KIL2IR,B0052FZPZI,{'Size:': ' Single Pack'},Scrapper,Can never have too much on hand. Best permanent adhesive out there.,Best permanent adhesive out there,1430697600,,
96433,4,True,"03 1, 2016",A1CDROJB8PDNZR,B000Y00DDK,,SmithLA,A little darker than I anticipated but worked well with my project.,Four Stars,1456790400,,
344474,4,True,"02 8, 2016",A3RQ92IPQPO0XI,B00LWE247U,,Jeffrey A. Moore,Great for keeping organized,Organized,1454889600,,
186089,5,True,"06 28, 2015",A13DH2B70CHJC4,B002RTKGW4,,pnkfuchsia,I actually use this for hanging my suncatchers. It is perfect and without distraction from the affect of the suncatcher.,Perfect for suncatchers,1435449600,9,
101900,5,True,"05 4, 2015",A2LMS17KVNCQV7,B000YZ5LIM,"{'Size:': "" 10/70'""}",Rd,Liked these needles for piecing quilt blocks.,Five Stars,1430697600,,
354281,1,False,"03 13, 2017",A3PA1Q5C43YY52,B00O7GPMEM,,Andie R.,THIS IS NOT FIMO EFFECT! THIS IS A HORRIBLE FAKE IMPERSONATING product. They should be ashamed of themselves for trying to pass it off as FIMO. YOU SHOULD NOT BOIL POLYMER CLAY. Save yourself the time and money and BUY REAL safety approved polymer clay from an actual store so you are not getting CRAP!,THIS IS A HORRIBLE FAKE IMPERSONATING product,1489363200,,
464800,5,True,"03 18, 2015",A1WF52OL0XT8EN,B00E1MTZ7C,,candy burge,awesome,Five Stars,1426636800,,
