,overall,verified,reviewTime,reviewerID,asin,style,reviewerName,reviewText,summary,unixReviewTime,vote,image
26181,5,True,"02 14, 2017",A30H2335OM7RD6,B000JKZGRS,"{'Size:': ' 9"" x 12"" Sheets (Pack of 12)', 'Style Name:': ' Fashion Colors (Sticky Back)'}",apoem,"I needed foam with sticky back to make a flashlight with a small battery and an led light. These came exactly as I had hoped. They were thick and squishy foam. The back of these sheets are sticky and covered with a nonsticky sheet of paper. The paper backing peels off easily.

This came in a variety of colors, but only one sheet of each.

The only thing I would note: If you are looking for several sheets of the same color, this would not be the package to buy.

Excellent.",Great product.,1487030400,2,
374913,4,False,"08 2, 2018",A3AZI828WJN1CD,B00WW8KIRI,{'Color Name:': ' 5 Natural Colors'},Becky (in NOLA),"The glue is great, pliable. You can also use it for crafts. It does take a day to cure and the shelf life is short. I saw where other people put it in the fridge so I'll try that. I fixed a small crack in a plastic case and it looks great. Fixed a small tear in a vinyl jacket, so far so good.",good and flexible,1533168000,,
404020,4,True,"07 8, 2016",A3NK98D17TAN6Q,B01BU85LD6,,V. Pennington,"Great colors, though the yellows stick occasionally. The others are really nice, though.",Pretty nice set.,1467936000,,
336879,5,False,"08 29, 2014",AC6C3EX1MB143,B00K8CQD2Y,{'Color:': ' 15 Gemstone Chips Assortment Value Pack'},RichieOrFelicia,These are better looking then the photos. I have made a few things already with them and am very pleased.,"For a unique and great look, a great buy",1409270400,,
274977,5,True,"11 20, 2015",A1EA7VHSTMV1CW,B00ADYYGRQ,,Jackie J,This stuff is amazing! I have played with it and mixed it in epoxy resin and acrylic paint and the glow is pretty great if you mix it right. I suggest making super small batches and just try it out for yourself!,This stuff is amazing! I have played with it and mixed it ...,1447977600,,
234802,5,True,"08 6, 2016",A25MTQ6553YMQH,B005JAFZWY,"{'Size:': ' 22"" x 28""', 'Style Name:': ' Linen13.0oz - 3X - Vintage Oil Primed'}",David Reames,"Excellent canvas. Drum tight, perfect tooth for me.",Terrific canvas,1470441600,,
309417,4,True,"02 9, 2017",AZ2QB6OHV12HP,B00EQXWPBY,{'Color:': ' 8x8mm/Ball Flower 02'},Amazon Customer,good,Four Stars,1486598400,,
296482,4,True,"07 3, 2015",A1HDJAHR198VE0,B00CUSMUZI,"{'Size:': ' With Free TYPE L bobbins', 'Color:': ' green'}",Jacque Marsh,It does as you said it would only thing is it says pink and I got green.,Incorrect color by description,1435881600,,
206189,5,True,"07 21, 2016",AI8XVQCRXAH90,B004A6B1CG,,Tom Durand,"Everyone can use WHITE NYLON thread, and this product fits the bill!
Thanks!",White nylon thread saves the day!,1469059200,,
460636,5,True,"08 24, 2015",ACMVWF7V2BB2H,B00C5WYPVQ,,Bram Cast-Hecht,Nice bling!,Five Stars,1440374400,,
81290,5,True,"04 15, 2017",A1MYVVLJMP7787,B00172XBQA,,Amazon Customer,Beautiful  c o l or and super soft,Beautiful c o l or and super soft,1492214400,,
426215,4,True,"12 16, 2014",A3MYAEQWFLNGT7,B00161N7L6,{'Style Name:': ' Threading Water'},A. Dangerfield,"I got the punch on time and used it the first time with out a problem.  Than I knocked it over by mistake and it came completely apart.  No not broken just in several parts the blade,3 springs and two plastic squares.  it took me a while and several attempts  to put it together again.  Then success  it works again.  I put two pieces of masking tape on the back to prevent this happening again.
Now I ask you if a 75 year old can do that where is the Fiskars engineer.",I got the punch on time and used it the ...,1418688000,,
370952,5,True,"09 18, 2013",A26GCSDJ1K6VUR,B00V1CNZ7G,{'Color:': ' Black'},Debra,Good product at a great value! Its so hard to find good quality cord in my area. This was perfect for my project and I didn't have to leave the house!,good value,1379462400,,
348339,5,True,"02 21, 2016",A2VCUW5IG6KFAI,B00MUABXRC,,Brenda,Love the case.  Really nice to have.,"Good product. Classy, useful case.",1456012800,,
186800,5,True,"01 12, 2014",A3HJ0QZBC5BPX7,B002U6YFUS,,Liette vanNiekerk,"I bought this punch for card making, and it has been a great addition to my collection.  Perfect size for various cards.",Love them punch!,1389484800,,
262175,5,True,"10 13, 2016",A1LMEIDC5LRAQB,B0087D3MKM,"{'Color:': ' 2 Large, 1 Medium'}",Tammy Wood,Great Idea so glad I ordered these haven't gotten to use yet but will soon,Sooo excited!!! Great idea!!!!,1476316800,,
107860,5,True,"06 24, 2016",AD2TIGJCJENRN,B001144TXI,{'Color:': ' Treble Clef'},Ginny O&#039;Neal,I bought this for my other grand daughter. She loves it. Te girls were sitting down and making these as soon as they opened the packages.,My grand daughters love these. I will be buying them more,1466726400,,
111464,5,True,"06 24, 2015",A1TUIST8529CC9,B00114RBSI,{'Package Quantity:': ' 1'},Greg Rodriguez,"Strong needles, worked perfectly to complete my project",Maybe use a thimble,1435104000,,
44229,5,True,"08 18, 2015",A1Q12F6KENVZBT,B000WWKDGW,,Judy E. Kelly,Very hady extra for scrapbooking,Five Stars,1439856000,,
296721,5,True,"02 14, 2018",A3F08S4XJ0G9G0,B00CX53K48,{'Color:': ' Original Version'},Suzy,Great for T-shirt quilt.,Five Stars,1518566400,,
100377,5,True,"03 17, 2014",A1Y63XRJIG9S0,B000YQI8KE,{'Color:': ' Pine Green'},Patricia Bergesch,"Had a marker like this before and I needed another
one it is just a great color use it alot in my scrapbooking.",Great marker,1395014400,,
372337,5,True,"10 2, 2016",A2SYRX5SMN4CRW,B00VQY2RUK,{'Size:': ' 8mm'},Wendi Gabriel,Product is as beautiful as advertised.  Very happy with my purchase,Five Stars,1475366400,,
227631,5,True,"12 5, 2012",A2N1SVMN6Q926K,B00557VF0M,,JDH,"I've used a cheaper version of the oscillating saw for a few years.  There is no comparison, the Dremel is well built and everything I expected.  I really didn't need another rotary Dremel tool. but you never know.  I haven't tried the other saw yet but I'm sure it will get used eventually.  Package arrived quickly.  Nice to have the tool bag.  I agree, it would have been nice to have dividers in it but with the tools, I'll just make my own!",Excellent tools and value priced.,1354665600,,
206664,5,True,"01 1, 2014",A3LH6ZURMBMID6,B004ALF72G,,Penny M.,Great size easy to use.  I have arthritis and have trouble holding hooks because of it.  This makes it so much easier.,Great from swollen hands with arthritis,1388534400,,
230212,5,True,"03 13, 2015",A15XI2BEGGFEOW,B005BZEAV4,,Led Jedi,"I've been in beading for a couple years now and have used all sorts of stringing material. This stuff has very rapidly become my favorite stringing material. It's EXCEPTIONALLY strong, cuts very cleanly and seems to wear very well. I've had a few crimps come loose over the years but i've never ever had this stuff break. I've also used the .014 size which is a step smaller and not ever had any problems with that stuff either. I know their description says you can tie knots in this stuff, but the larger diameter .019 doesn't knott well for me. The smaller stuff does a better job, but IMO crimping is the way to go with this material. The coating on the steel gives some excellent protection for the cable, but if you're going to use it with anything that's abrasive I would consider using loop protectors for the ends. I now buy this stuff in 100 foot spools.","This is my favorite stringing material, hands down.",1426204800,,
37079,5,False,"04 5, 2014",A2G3G322266QSJ,B000SNBCD8,,Happy Grandmom &amp; Grandpa,I purchased this tool set 8 years ago and they are still in great condition. I teach bead-making to adults and children. This is the kit I recommend to my students and I don't make a profit of any kind off the sale.  The quality is one of the best on the market. The price is fair.  The tips of the pliers are the perfect size.  They are easy to grip.  The sets they sell in the Big Box Craft Stores may be cheaper with a coupon but the quality is poor and the heads of the tools are bulky and do not line up well.  I have seen the same kit for sale on other sites and in stores for $50 to $65 so the Amazon price is a bargain.,Bead Smith Deluxe Tool Kit - Good quality and fair price.,1396656000,3,
355900,5,True,"05 14, 2015",AM4GYECHVI75I,B00OQJMHFC,,Lynn S,VERY nice!  Anxious to use them. So glad they are in a canvas roll up storage container.,VERY nice! Anxious to use them,1431561600,,
162886,5,True,"09 13, 2016",A3IYII82Q450MS,B001UP7X2M,,Anastasia,I needed an all purpose hammer for my small jobs and crafts. This is perfect. Also well constructed.,This is perfect. Also well constructed,1473724800,,
437547,5,True,"12 5, 2015",AFRYODRNCZ4ZT,B003IM0CMI,,Debbie Sue,love them,Five Stars,1449273600,,
394812,3,True,"06 5, 2017",A3G33HI2XONJ83,B018282FAO,{'Color:': ' 24 Colors'},J. Kilbourne,"These spools of thread are not bad, I would say the quality is not awesome as a few  knots in them.  The biggest problem I have is getting the first thread unwound.  There is absolutely no indication of where it starts so you have to cut and unravel a lot of thread to find it.  Its a good deal though because there are so many colors which I needed because I was starting to sew again and I didn't have any thread at all.",CANNOT FIND THE FIRST THREAD--a real mess,1496620800,2,
190684,5,True,"11 22, 2014",A2XSNMEZ5ZC3D9,B0037CO2R0,,Decolin,"Very good folders, and of course, you can't go wrong with Tim Holz.  They are a little pricey, however I found them to be very predictable and the embossing is excellent.",Excellent product and as advertised.,1416614400,,
321648,5,True,"02 22, 2017",A1KQC3WKKVX8NU,B00HFMLEUG,,Kindle Customer,I bought these for my knitting students so that they would have all of the gadgets that they need.,what a bargain,1487721600,,
326745,3,True,"04 26, 2018",A3HDIZ5JUQLD76,B00IGIQC4Q,{'Color:': ' Black'},ANM,"I have a Brother JX2517, and it fits inside this tote.  There are velcro straps to hold the machine in place inside the tote.  There is a small flat pocket on the front (good for thin items like paper, small ruler, scissors, etc.).  It doesn't stretch open very far, so nothing too big would fit.  That's the only storage on this tote (the black version).  At first I thought it had tons of zippered pockets on the inside, but those are just the openings where they inserted the cardboard sides.  So the tote is cardboard sandwiched between fabric (at least for the sides).  There is another color available, and it shows more pockets under the flap than this version.

The handle extends, but does not lock in place, so you can only pull one direction.  For example, my carry-on suitcase has handle that locks, so I can pull or push in any direction.  With this tote, if you try to go another direction or push instead of pull, the handles will not stay extended.  It's a bit inconvenient.  The handle is also still a bit short for me, so I can't really walk properly when I'm pulling it behind me.

It gets the job done, but if I could go back, I definitely would have bought a different tote.  One with more pockets so I don't have to carry another bag containing my supplies.  Or perhaps one with a strap to carry instead of one with wheels.

To me, it's not really worth the price.  There's no extra padding or support, and you don't really get any storage.",Not the best,1524700800,3,
409111,4,True,"04 7, 2015",AXIR9YLHX95VU,B01DTEDXMA,"{'Size:': ' 8-1/2"" x 11""', 'Color:': ' Clear', 'Style Name:': ' 6-Pack'}",j.m.blacklock sr,good product,great deal,1428364800,,
472642,5,True,"05 14, 2016",A3LSTGAP7LOV1S,B00J2TJIJE,,Alice Wakefield,"I tried the Martha mold but many of those letters have thin sides where the hot glue couldn't penetrate.  These are block-like and come out beautifully, with the added bonus of numbers as well.",Best letter mold for hot glue.,1463184000,,
290774,4,True,"09 16, 2014",A2O3E1BEZH2M16,B00C1LX5WQ,,PatKat9000,"Arrived in good condition in a reasonable amount of time. Very colorful and nice textures...the stickum, however, on the backs not so sticky. Recommended for scrapbooking.",Colorful!,1410825600,3,
146304,5,True,"03 11, 2015",A1JHZTPYMX0YS2,B001EHA5M6,,J. Davita-Rauch,Folds well.,Five Stars,1426032000,,
236543,5,True,"11 18, 2012",A3SES3WNI2O0XJ,B005N0POKS,{'Color:': ' Fly a Kite'},Painting Mama,"I make the ruffled scarves that are the rage these days, and Starbella works up beautifully and the color choices are fabulous.",I love this yarn!,1353196800,4,
407503,5,True,"01 13, 2013",A3CRWHE3YJC4M9,B01D3MWPU4,{'Style Name:': ' 4411 Sewing Machine'},Shirley P,Needed a heavy duty machine and this one is great. I am hoping it will be around for years to come.,Very sturdy looking machine.,1358035200,,
351460,5,True,"01 17, 2016",ADS99W8WMEXZ2,B00NI39OSU,,Michelle Dunn,"I am always using detail and liner brushes and normally wear them out.  I bought these AIT detail brushes here on amazon but had never tried this brand before.  I really like that they are made in the USA and that I could purchase 11 of them at once in various sizes.  So far I have used the #2 liner, #0 liner, #6 liner and the #2 flat brush.  I am VERY happy with these brushes and how they perform.  I rinsed them right out of the package before my first use, and they worked so well immediately - with no stray hairs coming out on my painting.  Very impressive.  The handles are a good size and very comfortable.  I am very happy with the quality of these brushes and may buy more in other sizes, I am always looking for filberts so will see if this company offers those.  Very good quality for the price.",Very good quality at a good price and made in the USA!,1452988800,10,
488985,5,True,"05 12, 2017",A2EWOM9SK7POEJ,B016RPYPTS,"{'Size:': ' 1 Roll/100 Yards', 'Color:': ' Navy blue'}",Aleyeh,"Soft, perfect navy color, not real but much better.  Will purchase again and again in various colors!  Finally found the perfect cord.",Perfect,1494547200,,
115048,5,True,"09 26, 2013",A3ACB9HMEVTCRE,B0013ES7KW,,Lionel S Abdool,"Perfect for modeling. If you have any projects that you know will require a good amount, the 400ml is the perfect choice.",Must Have for Modelers,1380153600,,
226303,5,True,"10 3, 2016",A2LIPZW6RZ4D0J,B0054H2OYO,,Recovering Warrior,Lovely colors. Looking forward to replacing destroyed sewing machine so can begin to sew again.,Fabric Palette 2 1/2 inch by 42 inch cuts,1475452800,,
216875,3,True,"12 3, 2014",A2LE4KMXK9O8OW,B004S67852,{'Style Name:': ' Modern Festive'},mzbeybgrl,"I am so glad that I didn't buy these for the initial $6...package came dust covered which I thought odd since it shipped from Amazon.  Colors are muted and I was expecting them to be brighter...but it is labeled as ""modern Festive""...so that's probably why it's ""lack lustered"" in color.",Meh...but it will work.,1417564800,,
301687,3,True,"11 3, 2016",AOE6HAVFCJSLY,B00DU694YO,"{'Size:': ' 14""X17""'}",Sara Rice,Canson paper is good but this used to come in a spiral.  Now that it doesn't I have to find another pad to hold my drawings.,Canson paper is good but this used to come in a spiral,1478131200,,
11502,5,True,"06 28, 2017",A3AGU816OV5OPV,B000980L0C,{'Size:': ' Locking Stitch Markers'},Amazon Customer,excellent quality,Five Stars,1498608000,,
287337,5,True,"08 30, 2016",A29GWIJL72GXXZ,B00BOLG4W2,,Jon,"GREAT!

Decent quality (better than I expected) amazing low price, and the long shipping time ended up almost 2 weeks early.","GREAT: Price, Quality & not so slow shipping",1472515200,,
203421,5,True,"06 23, 2017",A19Y0KWLKXQS2Y,B0042TMS1Y,{'Color:': ' Caribbean'},Fred,Very pretty colors--goes fast because it is nice and thick!  The recipient loved it!,fast,1498176000,,
429367,5,True,"09 12, 2017",A1FK3DJ62OP8DP,B001C2DUO8,{'Color:': ' Iridescent'},Colleen,"Paint went a long way at our baby shower.  We had our guests decorate white bibs and onsies and over 25 were done, with paint to spare!
The paint is shimmery which is very pretty.",The paint is shimmery which is very pretty.,1505174400,,
331030,4,True,"09 1, 2015",A2YCSBE5JKJ1WO,B00J4MRI4Q,{'Color:': ' Black with Silver'},Jeff H.,Product as described. Delivered on time.,Four Stars,1441065600,,
117027,3,True,"03 27, 2014",A3KMUENZXZSW0O,B0013UD43Q,,Sharon M. Ellis,I guess it is ok.  It appeared to be used when I got it and it scratched up a bit when I used it but over all it does the job for metal stamping.,metal bench,1395878400,,
175125,5,True,"02 23, 2016",A1X11U5XVRS5J,B00281K7UW,{'Color:': ' Candy'},Tiffany,"Great colors, great texture. For a scarf (which is what I am making) I need to use two strands, but those two skeins will make a full scarf (with extra). Very excited","Great colors, great texture",1456185600,,
445741,5,True,"10 20, 2016",A2KU25P6F3WTQ4,B005EI8AUU,,Amazon Customer,These were just won at a Silent Auction to benefit the RSVP INC animal rescue on Long Island.  They came out beautiful!  Seller is terrific.,Wonderful Kitten Duo,1476921600,,
488795,5,True,"04 7, 2017",A2PXVJNNYEYMXW,B016IB4GOU,,L. Nichols,"I love this die! It makes a nice size library pocket, the only issue is that no one has made a large stamp to fit the registry card that the die also cuts! To me this dis is a real money save - it is great for albums and junk journals! I added a photo of the assembled pocket for a size guide. The die is large and useful.",Awesome Die!,1491523200,14,['https://images-na.ssl-images-amazon.com/images/I/51ANa0bszAL._SY88.jpg']
102517,5,True,"07 4, 2014",A2SSQCATCYWC90,B000YZ5L9Q,{'Size:': ' 14/90'},Tijeras Lady,Very nice. Thank you!,Five Stars,1404432000,,
234689,5,False,"05 29, 2015",A1Y4HHMNSDC11A,B005J05CP4,"{'Size:': ' 1/4 LB', 'Color:': ' White'}",World&#039;s greatest air guitarist. ,"This product is incredible. Easy to use, working time is great. I bought a 12 inch Hulk figure from a thrift store for 99 cents. Converting it into a Batman figure. My new favorite medium. Cant wait to convert other models. Like the Aurora/Revell Frankenstein Big Plans for Him. If you are not sure about  this product or how to use it, you tube some videos on how to. Then go to town. Amazing product!!!!",Easy to use,1432857600,5,"['https://images-na.ssl-images-amazon.com/images/I/518DEOLX3PL._SY88.jpg', 'https://images-na.ssl-images-amazon.com/images/I/518DEOLX3PL._SY88.jpg', 'https://images-na.ssl-images-amazon.com/images/I/51l8LBOYYAL._SY88.jpg']"
400494,2,True,"04 27, 2015",A2FEHZH4459RIH,B01AHFPUDE,,SHELLY GEORGE,Not worth it. Too small and some were stuck together. Not as shown. I gave it 2 stars because it arrived in a timely manner and good packaging .,Not worth it.,1430092800,,
23629,5,True,"03 15, 2017",A3VYAPOYAB669M,B000HTBBO8,"{'Size:': ' 9.38"" x 9.38"" x 0.25""'}",Howard.Z,These pencils really did a good job.,These pencils are really good!,1489536000,5,['https://images-na.ssl-images-amazon.com/images/I/61L9SlY3sbL._SY88.jpg']
154706,4,True,"02 4, 2014",AKA8A0EX1JEYL,B0013ZEKJ8,"{'Size:': ' 12""x12""', 'Color:': ' Tranquil Aqua'}",ErinM,"I was looking for something acid-free to put some genealogical materials in - not the Magna Carta or anything, but documents I would like to see preserved if possible.  I found the scrapbook adequate to this task:  well-made and easy to disassemble for expansion.  The pages are sturdy, slide easily in and out of the plastic covers, and held up to my peeling off and re-positioning the adhesive photo corners.  One caveat - if your collection is very big  at all, just go ahead and order refill pages, as what comes with the scrapbook doesn't go very far.

The color was true to what is shown.  I would order this item again.",Good quality for the price,1391472000,2,
489262,4,True,"12 1, 2016",A233PECHFBWHRA,B017BD517K,{'Color:': ' 12pcs 12 Styles Awareness Ribbon'},Raina,"Nice themed charms, great for projects or jewelry making, a bit pricey though (4 stars only because of the cost).",Great!!!,1480550400,,
155463,5,True,"10 30, 2014",A29ZGNBUMQED0C,B001OV96K4,,patricia roth,nothing like a good tube of Grumbacher I have always loved this paint.,Five Stars,1414627200,,
433133,5,True,"04 12, 2015",A1BOSFLS38SYKU,B001ZRKQKG,,Elaine T.,I used the smaller and midsized needles on mittens and was very pleased.  There were no rough spots and having multiple sizes helped to get the right gauge.,Great product and great deal,1428796800,,
294558,5,True,"09 12, 2015",AR7IBWK9O139H,B00CICZ7ZQ,,Gerald D Schure,I was very happy with this item. It meet my expectations and work as described.,Five Stars,1442016000,,
30715,5,True,"03 4, 2016",A30SOHMMKGCQPK,B000O370A6,,W. D. Cunningham,"This is one of those tools that makes you stop and say ""do I really need this?""  After all, I had been managing so-so just by measuring a quarter inch from each side and drawing a line, marking a larger dot where the seam lines intersect.  It worked, but is time consuming. I will also mention that I was previously using a chalk pencil, so my accuracy wasn't the greatest - and provided the prompt to break down and buy this.  I had seen Jinny Beyer using it in her Craftsy class, but I was resisting the urge to buy yet another gadget.  After having to tear apart a block for the 4th time due to inset seams not matching, I pulled the plug.
With this device, I simply lay it on the appropriate angle and mark the dot, very quickly and accurately. The dots along the edge let you also mark the quarter inch line at intervals to help keep a straight line when hand stitching.
The holes are very small, so you would need a mechanical pencil....I opted for another tool, the Sewline chalk mechanical pencils.  The small holes force us to use a smaller marking tool, but it also improves accuracy.  My inset seams now go together beautifully.

There is another benefit to this tool.  At one point, I thought it was my stitching or marking that was the problem - it was actually that I cut my diamonds wrong.  A little slip with the ruler when cutting is easy to miss, but this tool makes it very easy to lay on the patch and check its angles. The most common 5 or 6 angles used in quilting are on the tool.  There is also a dotted line along the edge that you can use to check your scant quarter inch.

If you do any type of inset seams or angles in your quilting...or just want better precision on your triangles (who doesn't) - the perfect piecer will definitely save you time and frustration.",so my accuracy wasn't the greatest - and provided the prompt to break down and ...,1457049600,4,
376556,4,True,"02 27, 2017",A2K1XUC9CZ5EY4,B00XBMAO7S,,TeddyB,"I bought these scissors so that I could cut out small felt pieces for a few holiday decorations. The scissors cut through the thinner felt but not the heavier felt. They work great with thin fabrics. I will not be using them to cut paper. I like the smaller size, the pointed tip, and that I can see the line when I cut. I am left handed. The handles are a bit uncomfortable, especially when cutting out felt pieces. They are true left handed scissors which are hard to find in this smaller, pointed tip size. I am keeping these scissors and I know that I will be using them often.","Useful, smaller, pointed tip left handed scissors",1488153600,,
95212,5,False,"04 26, 2017",AXJO6V1I9ARG6,B000Y00DDK,,Amazon Customer,this is my moms rug I'm making her,I love this yarn,1493164800,,
465817,4,True,"11 16, 2016",A1X5LXRF8XLXZW,B00EPU9JV2,,V. Folsom,Good,Stamps,1479254400,,
14619,5,True,"11 1, 2015",A2IWRSWM9952YW,B000B7MUFK,{'Size:': ' 1 PACK'},Dottie Noyes,I cannot have enough of these.,Good value,1446336000,,
379520,4,True,"04 20, 2017",A3O67T4WXJ9HI9,B00Z9RP0KY,{'Color:': ' Colorful'},Patricia,"I would have given these scissors five stars but they did come with a lot of oil on them. Which was not expected but understood. Scissors need oil to work. After you wipe the oil off, especially if you are cutting cloth or yarn the scissors are really good. Great amount of scissors for the price. I was always loosing my scissors and these are great. I can stash a pair hear and there and always have a pair of scissors at hands reach. Do not pass this deal up. Especially if you misplace your scissors a lot like I do.",A lot of scissors for not a lot of dough. Great buy!!!!,1492646400,,
75291,5,True,"05 28, 2015",A3CO3RNEX901JM,B00164A8EC,,JoJo,I have to get all the accessories for my Sizzix Big shot.  I never know what I'm going to want to make next.  I don't want to be caught without the ones I may need on any given day.  These little ones are great for my tiny dies albeit I use the big bottom cutting pad with the smaller cutting pad on top.  It gives me more control on my tiny dies...that I just love.,These little ones are great for my tiny dies albeit I use the big ...,1432771200,5,
291297,5,True,"02 21, 2017",ATJ4J727JJDY8,B00C775504,,Linda  Zing,Works like a charm on fabric.  Love the ease of changing blades too!,Five Stars,1487635200,,
411775,2,True,"01 4, 2018",A1RKWMS4V2CYC7,B01EVJ8Q0G,{'Size:': ' 12 x 12ml'},VMD,3 tubes were dried out/gummy.  Greatly disappointed.,Greatly disappointed,1515024000,,
100844,5,True,"12 13, 2013",A1VIZFPC5FDDI5,B000YQLWZC,,Curtis K. Davis,"I love these because they are pre-waxed, and are also fairly thick wicks, which means they would hold a flame better when gentle breezes hit it. I would buy them again.",Excellent...,1386892800,,
461465,5,True,"08 21, 2017",A3IRF014D7DQ0Q,B00CIW41NU,{'Color:': ' Ink Spot'},A &amp;amp; M Ellestad,Love this color!! I have bought multiple times!!,Great color,1503273600,,
