,overall,verified,reviewTime,reviewerID,asin,style,reviewerName,reviewText,summary,unixReviewTime,vote,image
483297,5,True,"08 1, 2017",A3OIPXMJIGUN9R,B00USBJ3HM,,Amazon Customer,Great product!,Five Stars,1501545600,,
352335,4,True,"06 29, 2017",A6R4MQC0F7F1R,B00NQN2NQ2,"{'Size:': ' 12"" x 10\''}",M. Cook,Works great with my Silhouette Curio.,Nice,1498694400,,
166579,4,True,"01 17, 2014",A3HABVT1TDUZUP,B002518D1K,{'Size:': ' #1'},Sylvia,I trust Kolinsky Sable brushes and they last a long time with care. I look forward to keeping it with me for all my watercolur fun.,"It is balanced for such a small brush, looking forward to painting soon.",1389916800,,
428633,5,True,"11 29, 2015",A1NABJE5E1KBEP,B001A34JLM,,Valerie Shockency,Works fine. Little bigger than I need but it was the closest size and works as it should. I'm glad I have it!,Great to Have,1448755200,,
16931,3,True,"04 14, 2015",A1F6LLOFCB9KRO,B000BI1L18,{'Color:': ' Smiley Face'},Amy Ashley,Didn't come with enough yarn to finish it. And no I didn't lose any.mo,Three Stars,1428969600,,
188360,5,True,"02 26, 2014",A1T31WP8R4P12B,B002Y2GY7U,{'Size:': ' Small'},rhonda,I couldn't quilt without these on. In fact they are so comfortable I have several pairs and only take them off to shower.,Total comfort,1393372800,,
15684,5,True,"05 26, 2016",ADFELNXI77VXW,B000B7Q9KM,{'Color:': ' Wine'},Lauren,"I use Rit dye all the time, here are some helpful tips

Step by Step
CHOOSING FABRICS. Rit works best on many natural, washable fabrics and materials, such as: a. 100% cotton, linen, silk, wool, ramie
b. Synthetics such as rayon and nylon
c. Fiber blends with at least 60% cotton or other dyeable fiber (blends will tint evenly but will not achieve full color)
d. Nylon-based plastic such as those found in buttons, fasteners and lacrosse sticks
e. Natural materials such as wood, wicker, paper, feathers and cork But there are fabrics and materials that will not accept dye, such as: a. 100% polyester, acrylic, acetate, fiberglass, spandex and metallic fibers
b. Fabrics with rubber backing (bath mats or throw rugs)
c. Fabrics with special finishes such as water repellents
d. Fabrics with bleach damage or extensive staining
e. Fabrics washable only in cold water or labeled dry clean only
f. Polyethylene plastics such as golf discs
g. Polycarbonate plastics such as eyeglass frames
Fiber content and weight also effect how color appears making fabrics like cotton, wool and silk absorb dye differently, slightly changing the hue and brightness of the chosen color. If you are in doubt as to whether your fabric will accept dye or achieve the color you want, we recommend testing a swatch.
DYE PREP. Cover work area with a plastic table cover or newspaper and have paper towels or sponges handy to protect against any possible spills.
Wear rubber gloves to protect hands from getting stained and to insulate them when working with hot water.
Use plastic buckets or stainless steel pots for the dye bath. You can also dye in a stainless steel sink. Dont dye or rinse items in a porcelain or fiberglass sink or tub as they are likely to get stained./p>
ACHIEVING TRUE COLOR. Always follow manufacturers care instructions for your fabric as well as Rit Dye package or bottle instructions.
Remove stains on fabric or use Rit Color Remover before dyeing to get fabric to an off-white or cream color. This will help achieve uniform color results when dyeing.
Dissolve powder dye thoroughly in 2 cups of very hot water first to avoid dye spotting. Stir dissolved powder dye or well-shaken liquid dye into dye bath until evenly dispersed. Never pour liquid or powder dye directly on fabric unless looking to achieve a specific creative effect.
Be sure to use enough dye for the weight or size of the project. For example, for a pound of dry fabric (about 3 yards), use one package of Rit powder or 1/2 bottle of Rit liquid in 3 gallons of water. You want enough water for the fabric to move freely in the dye bath so that it can absorb the dye evenly across the garment.
When dyeing 1 pound of dry fabric in dark or bright colors such as Black, Dark Brown, Cocoa Brown, Navy, Purple, Wine, and Dark Green, use double the amount of dye (2 packages of Rit powder or 1 bottle of Rit liquid) in 3 gallons of water.
For the deepest color, use a water temperature of 140F/60C and keep heat constant while dyeing (the stove top method or a washing machine work best). Note: If tap water is not hot enough, heat water on the stove, in a teakettle or in the microwave.
If dyeing a garment more than one color, its usually best to start with the lightest color and move to the darkest.
For more intense color when dyeing fabrics containing cotton, rayon, ramie, or linen, add 1 cup salt to the dye bath. When dyeing nylon, silk and wool, add 1 cup white vinegar to the dye bath. If possible delay adding the salt or vinegar until 5 minutes after the fabric has been in the dye bath. The delay will help to promote level dyeing.
Add 1 tablespoon laundry detergent to all dye baths to help promote level dyeing.
The longer the garment is immersed in the dye bath, the deeper the resulting color. Items can remain in the dye bath up to 1 hour as long as the water remains hot. Youll also have to make sure the item receives constant agitation or stirring.
Garments will also look darker when wet and prior to washing.
When you remove clothes from dye bath, rinse in warm, then cool water until water runs clear. (Warm water helps to rinse off surface dye more effectively.)
Wash your fabric/clothes in warm water with mild detergent and then rinse thoroughly in cool water. Machine dry or hang dry.
CARING FOR DYED ITEMS. For the first two or three times, wash your dyed item by itself in cool water with a small amount of non-bleaching detergent. Always wash your dyed clothing with similar colors in cool water with mild detergent. Dry cleaning silks and special fabrics is recommended.
CLEANUP. Clean containers and sinks immediately after dyeing by scrubbing with hot water and powdered cleanser or bleach.
Clean washing machine using highest water level with hot water, detergent and 1 cup chlorine bleach using complete wash cycle. Clean lint traps. Plastic or rubber machine parts may be tinted but will not stain laundry.",Great Buy!,1464220800,19,
26282,5,True,"05 20, 2014",A1APLEGBOIHQ8E,B000JQQTGY,,J. W.,"Its perfect for me.  It very well made and a very good value for your money. It's versatile, stable and lovely to look at even without a single piece of artwork in its frame.  Its compact but seems to work well in every application.  I don't think you will be disappointed.",Just the ticket,1400544000,,
428736,5,True,"05 16, 2018",AKUH7V4HT3ZMA,B001AR7OWY,{'Color:': ' Black'},Stephanie,Works very well just as it is supposed to,Works very well just as it is supposed to,1526428800,,
436967,5,True,"03 8, 2016",A2N46YDOSO7GVH,B00393NOYE,,Rosie,good borders,Five Stars,1457395200,,
91190,5,True,"12 16, 2014",A12ARXJ6WP4IS0,B000XAJ5C6,,J. Fox,This stuff is great for all sorts of things.  It is like super double sided tape.  Very sticky and easily dispensed in a runner.  Works for crafts or scrap-booking.,This stuff is great for all sorts of things,1418688000,,
308666,5,True,"06 9, 2014",A2YAJHE6G0R1JW,B00ENSXBZ6,,Sam C,"Love the quality, flexibility and versatility of these stamps. Stamp clearly (I use Versafine usually with clear stamps).
Build your Own snowman with mix and match pieces so you get just the right effect, in the colors you choose.

I like the ability to use the tie, scarf, hats, smiles with other stamps. Even Snowflakes are included to help make a background.",Clear Stamps from Penny Black Build-a-Snowman,1402272000,3,
452136,5,True,"06 4, 2017",A32N1MT0A5IPLG,B007PMP5DS,,Amazon Customer,"I love it, I use it for watercolors lettering and regular drawing. After one month it cracked and I was very upset because it is the most expensive brush that i have and use it most often. But I decided not to open a dispute and fixed it with the glue. Anyway it is a good product.",like,1496534400,,
22559,3,True,"01 19, 2016",A364MRZ74VXM8I,B000H6OYSQ,{'Color:': ' Turquoise'},Zaria,Very neon almost... I wish i got pale blue,too neon,1453161600,,
456740,3,True,"06 3, 2015",A12ANL8RYWGP69,B00AO75PHM,,Ivy Hinson,Good Product,Three Stars,1433289600,,
202179,5,True,"12 14, 2014",A2TO9IZ4G6PKKN,B00409RMNK,{'Size:': ' 1/4-Inch by 36-Yard'},maricela trevio calvillo,vert good,Five Stars,1418515200,,
369926,5,True,"01 29, 2017",A15U5XZ101DEHL,B00USPO508,"{'Size:': ' 6"" by 8""'}",Annod,Appears to be fine. I have only used it once. I love the large words.,Love the large words!,1485648000,,
480169,5,True,"02 3, 2017",A1Z1WLK39TMFBG,B00P1ODU0C,,Faith,Nice quality and amount of beads to work projects.  Love the colors.  Can make one large project or many smaller matching ones...,Pretty,1486080000,,
364597,5,True,"03 2, 2016",ABB85GRU0TA1O,B00SIT4QT6,{'Size:': ' 4mm'},Nancy I. Sirico,Beautiful beads!  Very happy with my purchase.,Beautiful beads,1456876800,,
296645,5,True,"03 22, 2018",A19SQDI2R85NFS,B00CWI2U0Q,,Raymond G. Dean,Makes TOTALLY accurate pineapple blocks completely do-able!,Five Stars,1521676800,,
103547,5,False,"07 20, 2017",A1SD20KXWJRIOK,B000YZ8IBE,{'Color:': ' Size 14/90 5/Pkg'},Delores,Great quilting needles.  Much cheaper at Amazon.,Five Stars,1500508800,,
102731,5,True,"04 8, 2018",A2TZE95IKMTL72,B000YZ5NJE,{'Size:': ' 10 count'},Jackie Ochsner,replenishing my supply,Five Stars,1523145600,,
42314,5,True,"09 26, 2011",A2D2PVM65VJ620,B000WOV83M,"{'Color:': ' Grey', 'Style:': ' Expression'}",Maurcio,"I loved it, really good! Cut to perfection and is very beautiful! Not very good for fine papers, low thickness, but I met with perfection!

(Adorei, muito boa mesmo! Corta com perfeio e  muito bonita! No  muito boa para papeis finos, de baixa espessura, mas me atendeu com perfeio!)",Perfect (Perfeita),1316995200,,
265624,5,True,"01 15, 2016",A1BK041OF5EGMH,B008UATQES,,Tom,Beautiful,Five Stars,1452816000,,
481915,5,True,"02 6, 2018",A21Q2VTQXAJPQQ,B00SM6VWZ6,"{'Size:': ' 7~10x4~10mm', 'Color:': ' Antique Silver-6 Styles'}",diane potocar,Ok,Five Stars,1517875200,,
428492,5,False,"09 8, 2017",A16YQUU6KSX52A,B0019KDY76,{'Size:': ' 1 Pack'},Evol Jenius,These work great for tightening my interchangeable knitting needles.,Great,1504828800,,
37292,5,True,"06 12, 2015",A39J52SF1RYD5D,B000SN2JWQ,,Virginia L. Thompson,Great.  Just what I was looking for.  Arrived quickly,Great. Just what I was looking for,1434067200,,
47851,3,True,"12 11, 2012",A1UMV7RV23S0QZ,B000XAR0DM,,hibernation,"will probably get resin from hardware store when this is gone.
i think it's the molds i'm using (castin' craft mold builder) but it does not turn clear",okay product,1355184000,,
24972,5,True,"09 11, 2014",A3JDUI4EY73X12,B000IK0EIA,,muffin,came in excellent condition,Five Stars,1410393600,,
360830,5,True,"11 1, 2016",A2T1T5S6Z14GD1,B00QTGJIA2,"{'Size:': ' Elastic String', 'Color:': ' White-60m'}",Kindle Customer,It's alright I prefer a not her brand sorry,Five Stars,1477958400,,
16345,5,True,"03 11, 2016",ARO3EX3J3YQAZ,B000B8373S,,Janet W.,It is the correct size for the jacket that needs the zipper replaced. This will work wonders!,Perfect Fit,1457654400,,
373373,5,True,"05 15, 2016",A2NS0T5LROE13C,B00W7BNIOK,,J. Henning,Good quality pens. Long lasting and smooth,Five Stars,1463270400,,
23752,5,True,"07 28, 2015",A4QPM421JB8HX,B000HTBBO8,"{'Size:': ' 9.38"" x 9.38"" x 0.25""'}",sandi,good pencils,Five Stars,1438041600,,
281592,5,True,"05 14, 2018",A2PLGZMLYG18XL,B00B7LPHDG,{'Color:': ' Glitter Clear'},Susan,Love this product to add a bit of shimmery bling to finish off my cards with a flair.,Pleased with purchase,1526256000,,
283753,5,True,"03 1, 2018",A17J4SPF0R1YEI,B00BD91PC4,,Morbious2,"Love the colors. Nice company to do business with. Shipping was excellent. Will order again! It was very nice that they let me know personally, that my order was shipped!",Great for seed beading and embroidery!,1519862400,,
313348,5,True,"12 16, 2014",A117X35Q8E8VGG,B00FJTDR7A,,Amazon Customer,We are using these as gifts! Thank you.,Five Stars,1418688000,3,
295038,5,True,"10 9, 2015",A3IEM27QFV39ZV,B00CLCL3PQ,,LaurBon1,Received them very quickly and are exactly what I've been wanting. I can't wait to do more smaller designs without using so much stabilizer.,Sturdy and durable,1444348800,,
300334,5,True,"07 28, 2017",A273IS5C6ZGJO4,B00DNTWZN0,{'Size:': ' L4S'},Ruby Nelson,Work great for my artwork.,Five Stars,1501200000,,
395548,4,True,"03 3, 2018",A1O0FTZW2UFGD5,B018DK2IIK,,Michael S Roberts,not sure how to get it to sit more firmly on the fabric,Four Stars,1520035200,,
36147,5,True,"10 7, 2017",A1D9KK87RIS4J9,B000S5OWCO,{'Style Name:': ' 15 Colors'},Linda Crowder,"The best thing in adult coloring.  All you need is a drop of water!  I love this brand. They are highly pigmented, dissolve quickly with water and holds the pigment color through the gradation.",Love my Neocolors,1507334400,,
123364,4,True,"02 16, 2015",A1EK36UDSXA27P,B001689QKU,,kakepo,Perfect for cheer pins,Great,1424044800,,
385681,5,True,"11 13, 2015",A8BCAGMZUXXWJ,B014190TYC,,Joy Blonska,Love using these.  So cute.,Sweet and Easy,1447372800,,
284075,5,True,"12 21, 2014",AZTSEQPENAZGP,B00BDRZAKO,,Sharion Carpenter,Exactly what I wanted!,Five Stars,1419120000,,
250049,5,True,"10 9, 2014",A1ODGFW5U9HEWI,B0070GIDA6,{'Size:': ' 1 Pack'},Julie Rozcicha,this is one of the best products ever invented. I buy stamp at garage sales and sometimes I find them that have never been mounted or that the mounting is bad. This is the best product on the market in my opinion for replacing this.,this is one of the best products ever invented,1412812800,,
90117,5,True,"03 6, 2016",A3HMTFKHF00FKO,B000WWKE5W,"{'Color:': ' Small 2.25""x1.75"", Medium 3.5""x2.5""'}",Kris Delancy,Perfect,Perfect,1457222400,,
77158,5,True,"01 2, 2013",A2BILUPJR1QK94,B0016859GU,,S. Horton,"These are very versatile for all kinds of different stamps, and I like the grid for stamp placement and for stamping.",Fiskars Stamp Block set,1357084800,,
438207,5,True,"02 17, 2018",A36C2UAP6T9DSN,B003VWJ0N2,"{'Size:': ' 8.5"" x 11""'}",rhealy,good,Five Stars,1518825600,,
106557,5,True,"01 28, 2015",A3LSB17EER3744,B000YZ7G44,{'Size:': ' 12 oz'},R. Cooper,Perfect for stuffing kids' toys.,Five Stars,1422403200,,
389338,1,True,"01 9, 2016",AUOJNUMTTZ8RV,B015OEDEBS,"{'Size:': ' 7PCS', 'Color:': ' Purple'}",Colorado gal,"I so regret the purchase of this fabric.  It is some of the poorest quality I've ever seen, extra thin, flimsy, just awful.  I'm sorry I discarded the packaging before closely looking at it. I would have promptly returned it.  The hand is rough and it has a very low thread count. I have been quilting for many years and cannot use this.",Very poor quality!,1452297600,10,
291396,5,True,"07 9, 2015",AFBH4QIOXW8EH,B00C7AZSA8,"{'Size:': ' 3 yard', 'Color:': ' Apple Green'}",Mdotsie,Beautiful ribbon. Can't wait to use it!,Pretty ribbon,1436400000,,
190908,5,True,"06 25, 2014",A1P3TA8PZWGMQH,B0037XPAMA,,Butch and Nancy,"I just love doodling around and thought why not use color to it. So, I shall be using them for fun and to color my knitting charts.",color pencils,1403654400,5,
238381,5,True,"08 18, 2016",A6VCTMCGI1NO6,B005Q0UL3A,,Gloria Borrero,When I shop from Beadaholique I know I am getting good quality items.  I just wish the shipping charges would be lowered.,... I shop from Beadaholique I know I am getting good quality items,1471478400,,
344699,5,False,"10 14, 2014",A152QOJR54SMSV,B00LZNK812,{'Color:': ' 4mm 1000pcs Mix Lot M02'},Beth Annon,Beautiful colors and good quality,Just as described!,1413244800,,
473629,5,True,"06 1, 2017",A2CZ3Q7CCY0NMO,B00JPBWTA4,,Brigitta Tatai,beautiful colors!,Five Stars,1496275200,,
126523,5,True,"03 28, 2017",A4QE3YI51QFRJ,B00172XBQA,,Tiwadi,"Its a good quality yarn. I bought the red color and its a beautiful red. I am new to the crochet world,learning and experimenting. I made a hat and bootie with this yarn to gift and it turned out great. Will purchase more.",Happy with the quality,1490659200,,['https://images-na.ssl-images-amazon.com/images/I/71ultE8EkwL._SY88.jpg']
229712,5,True,"05 13, 2016",AKHFW2UK9M0U7,B0058V9KMK,{'Package Quantity:': ' 1'},Angela Holt,"This product is absoulty amazing!!!! I am a professional Crafting Educator and Designer both off line and through my youtube channel. I was introduced to this product and soooo very happy that I was. I was even contacted by the company and was given great tips to on how to use this product!!! Please follow the link below for my complete video showing you how I used this product!!!

YES: it sets up in 10 mins
YES it is a quality resin
YES this will always be my GO to resin and choice
YES this company offers soooo many wonderful other product that you can use to create with!!

LINK TO VIDEO: [...]",Truely a Fabulous Resin with Professional Result!,1463097600,,
281589,5,True,"02 23, 2014",A33NIB07LE8Y2D,B00B7LPHDG,{'Color:': ' Glitter Clear'},Les V,"I've watched so many crafters use this PEN and had to have it.  I've been delighted with the results.  The shipper was a little slow in getting it to me, but it was worth the wait.",So much fun.,1393113600,,
237590,1,True,"05 5, 2014",A1ESSAN2Z2LJQQ,B005P1THU8,,Janet Taylor,This product does not work in my machine. This awful outcome could have been avoided if in the product description You Amazon would explain which machines this die would work in or not work in. I have found another source for my purchasing of this type of product. So LONG!,I do hate It!,1399248000,,
395780,5,True,"01 8, 2017",A3F6CROJ76N8UB,B018HB5D2I,,naynay,This is a great item.,Five Stars,1483833600,,
475477,2,True,"10 16, 2017",AWGJ4R6FPX4C6,B00KYA8BWK,,V. Lopez,"Love the price and great product.  However, It takes forever to find the end of the thread so that I can begin my sewing project. Thread is packed down so tight that it's hard to get it started.",Love the price and great product,1508112000,,
322385,5,True,"01 6, 2016",AIQ31422AZ4WG,B00HMQ8HB4,{'Color:': ' Random'},Kindle Customer,Excellent deal. Just wipe off the oil that keeps them from rusting.,Excellent buy,1452038400,,
143646,5,True,"12 14, 2014",A215OMAATIEWLK,B001DIQ5SE,,N. Rupp,"Wow, I had never used this before and it is perfect for going over my cards and then adding glitter.",I had never used this before and it is perfect for going over my cards and then adding glitter,1418515200,,
22429,5,True,"01 25, 2014",A1IBQG6CXX6UT7,B000H6KZYI,,Pam S.,"I bought this as a gift for my daughter and she loves it. At that time she was living with me and would tell me every time she used it how wonderful it was - that was at least 2 times a week. I watched her assemble it - no problem at all. The dials were a little stiff at first, but after a couple weeks they seemed to loosen up a bit and were easier to unloosen and tighten up again and still hold their position.  It's very easy to pin pattern pieces and fabric to while adjusting and fitting everything prior to sewing.  It was exactly as described and a good value!",Great Dress Form!,1390608000,9,
493581,5,True,"02 22, 2018",A2AKB9NVYEIL1I,B01FFYIUAC,,Jennessa Stevens,Absolutely LOVE,So many colors!,1519257600,,
489632,5,True,"03 4, 2018",A3C0LSYAV67RWW,B0182J57KI,,Joyce Stonesifer,love these,Five Stars,1520121600,,
259187,5,True,"02 25, 2014",A40UTSS993WSK,B007QS33QW,, GrandpaJake ,In the past I found if you push too hard on the arm that opens the clasp they will break.  I press as hard as I could within normal usage and they had a great feel and so far not one has broken.  I think you will be very happy with this Clasp.,Very Strong and well made,1393286400,,
64616,5,True,"04 15, 2015",A1P03QPXTPZG2X,B00114Q8NW,,Jan,Thank you :),Five Stars,1429056000,,
176002,5,True,"05 14, 2014",A279IWY4IXQAJ3,B00281K7UW,{'Color:': ' Lavender'},Karen L. Frye,It is exactly what I needed.  I had trouble finding the shade and it matches the yarn I bought years ago perfectly.,Yarn,1400025600,,
220492,4,True,"06 4, 2017",A7821UWSQ2OUP,B004XWA736,{'Size:': ' 10'},Sylvie C.,"Fast shipping. I like the larger eyes of longer Milward's #10 milliners needles better, but the cheaper needles bend out of shape easily. Richard Hemming needles don't bend.",Not large eyes as stated on the package.,1496534400,,
424999,5,True,"05 5, 2016",A1PYPVOWAOM63U,B00114RIWM,,A of the M&#039;s,"I do a lot of painting and I always buy DecoArt paints.  The color, black, is used so often I ran out so when placing other orders I added this to it and was able to replenish my stash.  Love DecoArt quality.  Always the best!",Can't Go Wrong with DecoArt Paints,1462406400,,
255774,5,True,"03 9, 2014",AGZ1HS2KBSFRG,B007J4DIM2,,DEJIA,I have to many projects at one time to use all the items ' I will get around to them soon,Getting going,1394323200,,
17127,3,True,"12 31, 2017",A3KATH0698VHHJ,B000BNLLHW,{'Size:': ' 45mm'},Pugmomma,I have the Fiskars stick rotary cutter and wanted this because it automatically closes the safety shield. My Fiskars are way better.,Just ok...,1514678400,,
302861,5,True,"11 6, 2016",A3398YHVKYL88F,B00DV8XBLI,,LightPixie,"The header is stiff enough to hold curves between clips; I used 6"" spacing but it might be just fine with more. Once the header was ironed and pinned with the tape encased inside, the layers sewed easily and the finished look is professional. BTW: the tape is a poly synthetic very similar to non-woven Pellon interfacing. In my application the header tape has to be something that wouldn't become limp and or be susceptible to mildew when subjected to wet/damp weather. This product is just right for that kind of outdoor use and I'd definitely use it again.",Just right for outdoor curtains!,1478390400,7,
398849,5,True,"03 14, 2017",A527K8V3LZ54B,B019RZNYBU,{'Material Type:': ' bottle.'},Suzan K. Hawbaker,Love the case and it absolutely met my needs.  I am not an artist but my grandkids are.  This keeps the pencils organized and tidy and they worl great.,Love the case and it absolutely met my needs,1489449600,,
391665,5,True,"04 15, 2016",A2J03O2U029PRD,B016R0HSKG,,ChiefB,Look good and perfect for landyards.,Five Stars,1460678400,,
375196,5,False,"09 30, 2013",A2YCEKVUN1W5F1,B00WW8KIRI,{'Color:': ' 5 Colors'},"K. Salinger, Holistic Nurse Practitioner","This stuff is pretty neat! I used it to repair a polly pocket doll for my daughter (see pictures). We had tried to glue it previously but it popped open in the repaired spot again, and superglue would've made the legs not bend or the waist twist. I decided to give this stuff a go & it works great to repair the doll.

The front of the polly's waist/pelvis area popped off and inside two legs attach, plus the waist rotates side to side. If you don't glue it right then the legs won't move anymore, nor will the waist twist, so it was a tricky thing to repair (and, of course, this particular polly HAD to be repaired as it was one of my daughter's favorites and no longer sold). I was able to repair the doll body with this stuff w/o sacrificing the movement of it's legs and in a way that it almost can't pop open again. I used a few small balls of it to ""glue"" the previous attachment points inside, then rolled a narrow band of it and put around the outside, sort of like a belt, to further support it staying together. I'm sure I could've worked a bit more and matched the color exactly, but the green I came up with was close enough for us.

re: some of the criticisms on other reviews:

expiration date - who cares? Almost everything has an expiration now days and you can typically ignore that unless it's food you're worried will expire. I can't imagine this stuff is going to suddenly decompose or solidify in their air-tight packets on the expiration date. I'm not worried about this, and if I remember to look June of 2014, I'll update my review to let you know if it did self destruct or whatever people are worried will happen.

Wasted after opening packet - I cut a corner of the packet and used my nail on the outside to push some out of the slit, then pressed it down along the slit where there was still some of the rubbery stuff. Essentially, I didn't let any air into the packet, and the rubbery stuff at the slit resealed it for me. I can squeeze the rest of the packet (away from the slit) and it's stil pliable, so I'll be able to still use the rest. If you open the whole thing up, then of course, it will dry out. Just be careful about how you do it and the rest will not be wasted.

-----

I think this stuff is pretty neat and super handy to have around. I'll keep it on the shelf next ot my duct tape and super glue, as it's one of those type things that can come in really handy, and can fix stuff the other two might not be able to fix. I like that there are colors that can be mixed, and if you're careful you don't have to waste the rest of the packet you open. Pretty neat stuff - I like it!",works great - can repair a number of things that superglue just isn't right for,1380499200,65,['https://images-na.ssl-images-amazon.com/images/I/615Kr1g7r9L._SY88.jpg']
92712,5,True,"05 26, 2014",A1A6HLEOQL7UUF,B000XAPF98,{'Package Quantity:': ' 1'},Photographs by Shelly Fegter,"Bought these to go with the scrapbook: ""MBI by MCS Fashion Fabric 12-Inch by 12-Inch Page Top Load Scrapbook with Photo Opening, Blue, 12.5 x 13.5 inches"" that I bought.  Both the scrapbook and the extra pages are great quality, and the pages were very easy to add to the scrapbook.","Good Quality, Easy to insert",1401062400,,
151457,5,True,"05 25, 2015",A23QHQ4I3STNG7,B001K66DMC,,Cindy Garaas,I love warm company batting.  This is the only brand I buy.  I usually buy the big bolts but this was a great buy and I can get quite a few baby quits out of this one for my church charity.,Love Warm Company Batting,1432512000,,
